[
  {
    "id": "1144535464",
    "title": "Baptism of Josiah Griffieon (11/7/2025)",
    "url": "https://vimeo.com/1144535464",
    "date": "2025-12-08T15:30:46+00:00",
    "duration": 122,
    "description": null,
    "privacy": "anybody"
  },
  {
    "id": "1144516365",
    "title": "From Promise to Presence: The Mother's Song (12/7/2025)",
    "url": "https://vimeo.com/1144516365",
    "date": "2025-12-08T14:29:33+00:00",
    "duration": 2378,
    "description": "Chris Cross preaches",
    "privacy": "anybody"
  },
  {
    "id": "1143286734",
    "title": "Systematic Theology class 13 - 12/3/25",
    "url": "https://vimeo.com/1143286734",
    "date": "2025-12-04T01:35:50+00:00",
    "duration": 5872,
    "description": null,
    "privacy": "anybody"
  },
  {
    "id": "1142099001",
    "title": "Host an International Video",
    "url": "https://vimeo.com/1142099001",
    "date": "2025-12-01T15:15:23+00:00",
    "duration": 174,
    "description": null,
    "privacy": "anybody"
  },
  {
    "id": "1142090830",
    "title": "From Promise to Presence: The Births' Foretelling (11/30/2025)",
    "url": "https://vimeo.com/1142090830",
    "date": "2025-12-01T14:52:30+00:00",
    "duration": 2640,
    "description": null,
    "privacy": "anybody"
  },
  {
    "id": "1141844547",
    "title": "It's Christmas! Northpoint Kids",
    "url": "https://vimeo.com/1141844547",
    "date": "2025-11-30T17:34:42+00:00",
    "duration": 192,
    "description": null,
    "privacy": "anybody"
  },
  {
    "id": "1141843040",
    "title": "Glorious Night",
    "url": "https://vimeo.com/1141843040",
    "date": "2025-11-30T17:26:25+00:00",
    "duration": 217,
    "description": null,
    "privacy": "anybody"
  },
  {
    "id": "1140134789",
    "title": "The Promised King: Repents Again (11/23/2025)",
    "url": "https://vimeo.com/1140134789",
    "date": "2025-11-24T18:05:30+00:00",
    "duration": 2470,
    "description": null,
    "privacy": "anybody"
  },
  {
    "id": "1140064976",
    "title": "God You're So Good",
    "url": "https://vimeo.com/1140064976",
    "date": "2025-11-24T14:51:26+00:00",
    "duration": 250,
    "description": null,
    "privacy": "anybody"
  },
  {
    "id": "1139120450",
    "title": "From Promise to Presence",
    "url": "https://vimeo.com/1139120450",
    "date": "2025-11-20T23:52:11+00:00",
    "duration": 39,
    "description": null,
    "privacy": "anybody"
  },
  {
    "id": "1138748297",
    "title": "Systematic Theology class 12 - 11/19/25",
    "url": "https://vimeo.com/1138748297",
    "date": "2025-11-20T01:37:52+00:00",
    "duration": 4617,
    "description": null,
    "privacy": "anybody"
  },
  {
    "id": "1138705073",
    "title": "From Promise to Presence",
    "url": "https://vimeo.com/1138705073",
    "date": "2025-11-19T22:43:20+00:00",
    "duration": 39,
    "description": null,
    "privacy": "anybody"
  },
  {
    "id": "1137730326",
    "title": "The Promised King: Praises (11/16/2025)",
    "url": "https://vimeo.com/1137730326",
    "date": "2025-11-17T15:48:49+00:00",
    "duration": 2659,
    "description": null,
    "privacy": "anybody"
  },
  {
    "id": "1137718218",
    "title": "Baptism of Claire Loveridge (11/16/2026)",
    "url": "https://vimeo.com/1137718218",
    "date": "2025-11-17T15:21:11+00:00",
    "duration": 109,
    "description": null,
    "privacy": "anybody"
  },
  {
    "id": "1137716902",
    "title": "The baptism of Elliot Greenlaw (11/16/2025)",
    "url": "https://vimeo.com/1137716902",
    "date": "2025-11-17T15:17:46+00:00",
    "duration": 118,
    "description": null,
    "privacy": "anybody"
  },
  {
    "id": "1136319767",
    "title": "Systematic Theology class 11 - 11/12/25",
    "url": "https://vimeo.com/1136319767",
    "date": "2025-11-13T01:34:50+00:00",
    "duration": 4530,
    "description": null,
    "privacy": "anybody"
  },
  {
    "id": "1135430029",
    "title": "The Promised King: Confesses (11/9/2025)",
    "url": "https://vimeo.com/1135430029",
    "date": "2025-11-10T17:28:16+00:00",
    "duration": 1724,
    "description": null,
    "privacy": "anybody"
  },
  {
    "id": "1134065220",
    "title": "Systematic Theology class 10 - 11/5/25",
    "url": "https://vimeo.com/1134065220",
    "date": "2025-11-06T01:33:53+00:00",
    "duration": 4701,
    "description": null,
    "privacy": "anybody"
  },
  {
    "id": "1133168402",
    "title": "The Promised King: Grieves (11/2/2025)",
    "url": "https://vimeo.com/1133168402",
    "date": "2025-11-03T15:48:38+00:00",
    "duration": 2074,
    "description": null,
    "privacy": "anybody"
  },
  {
    "id": "1133162015",
    "title": "The Baptism of Gabriel Jeter (11/2/2025)",
    "url": "https://vimeo.com/1133162015",
    "date": "2025-11-03T15:29:26+00:00",
    "duration": 173,
    "description": null,
    "privacy": "anybody"
  },
  {
    "id": "1131909623",
    "title": "Systematic Theology class 9 - 10/29/25",
    "url": "https://vimeo.com/1131909623",
    "date": "2025-10-30T00:39:07+00:00",
    "duration": 4840,
    "description": null,
    "privacy": "anybody"
  },
  {
    "id": "1131713920",
    "title": "Burchard's Story: God Had a Plan",
    "url": "https://vimeo.com/1131713920",
    "date": "2025-10-29T14:38:28+00:00",
    "duration": 198,
    "description": null,
    "privacy": "anybody"
  },
  {
    "id": "1130931247",
    "title": "The Promised King: Trusts (10/26/2025)",
    "url": "https://vimeo.com/1130931247",
    "date": "2025-10-27T14:38:50+00:00",
    "duration": 2384,
    "description": null,
    "privacy": "anybody"
  },
  {
    "id": "1130926269",
    "title": "Baptism of Cai Munson (10/26/2025)",
    "url": "https://vimeo.com/1130926269",
    "date": "2025-10-27T14:26:06+00:00",
    "duration": 42,
    "description": null,
    "privacy": "anybody"
  },
  {
    "id": "1130925787",
    "title": "Baptism of Emory Munson (10/26/2025)",
    "url": "https://vimeo.com/1130925787",
    "date": "2025-10-27T14:24:50+00:00",
    "duration": 35,
    "description": null,
    "privacy": "anybody"
  },
  {
    "id": "1130924184",
    "title": "Baptism of MacKenenzie Foshee (10/26/2025)",
    "url": "https://vimeo.com/1130924184",
    "date": "2025-10-27T14:20:47+00:00",
    "duration": 54,
    "description": null,
    "privacy": "anybody"
  },
  {
    "id": "1129715862",
    "title": "Systematic Theology Class 8 - 10/22/25",
    "url": "https://vimeo.com/1129715862",
    "date": "2025-10-23T00:27:05+00:00",
    "duration": 4694,
    "description": null,
    "privacy": "anybody"
  },
  {
    "id": "1128874226",
    "title": "The Promised King: Rediscovers (10/19/2025)",
    "url": "https://vimeo.com/1128874226",
    "date": "2025-10-20T14:23:58+00:00",
    "duration": 2339,
    "description": null,
    "privacy": "anybody"
  },
  {
    "id": "1127221670",
    "title": "Baptism of Cliff Dolton (10/12/2025)",
    "url": "https://vimeo.com/1127221670",
    "date": "2025-10-14T15:32:24+00:00",
    "duration": 147,
    "description": null,
    "privacy": "anybody"
  },
  {
    "id": "1127219219",
    "title": "Baptism of Landon Couch (10/12/2025)",
    "url": "https://vimeo.com/1127219219",
    "date": "2025-10-14T15:25:19+00:00",
    "duration": 38,
    "description": null,
    "privacy": "anybody"
  },
  {
    "id": "1127212584",
    "title": "Baptism of Landrie Smith (10/12/2025)",
    "url": "https://vimeo.com/1127212584",
    "date": "2025-10-14T15:05:47+00:00",
    "duration": 48,
    "description": null,
    "privacy": "anybody"
  },
  {
    "id": "1127209257",
    "title": "Baptism of Melissa Carleton (10/12/2025)",
    "url": "https://vimeo.com/1127209257",
    "date": "2025-10-14T14:56:40+00:00",
    "duration": 134,
    "description": null,
    "privacy": "anybody"
  },
  {
    "id": "1127205874",
    "title": "The Promised King: Struggles (10/12/2025)",
    "url": "https://vimeo.com/1127205874",
    "date": "2025-10-14T14:46:47+00:00",
    "duration": 2416,
    "description": null,
    "privacy": "anybody"
  },
  {
    "id": "1127204915",
    "title": "Baptism of Rylan Baker (10/12/2025)",
    "url": "https://vimeo.com/1127204915",
    "date": "2025-10-14T14:44:14+00:00",
    "duration": 61,
    "description": null,
    "privacy": "anybody"
  },
  {
    "id": "1125620054",
    "title": "Wales",
    "url": "https://vimeo.com/1125620054",
    "date": "2025-10-08T17:53:57+00:00",
    "duration": 262,
    "description": null,
    "privacy": "anybody"
  },
  {
    "id": "1125286969",
    "title": "Systematic Theology Class 7 - 10/1/25",
    "url": "https://vimeo.com/1125286969",
    "date": "2025-10-07T18:50:30+00:00",
    "duration": 4738,
    "description": null,
    "privacy": "anybody"
  },
  {
    "id": "1125277216",
    "title": "Systematic Theology Class 6 - 9/24/25",
    "url": "https://vimeo.com/1125277216",
    "date": "2025-10-07T18:19:10+00:00",
    "duration": 4345,
    "description": null,
    "privacy": "anybody"
  },
  {
    "id": "1124844969",
    "title": "The Promised King: Repents (10/5/2025)",
    "url": "https://vimeo.com/1124844969",
    "date": "2025-10-06T13:49:00+00:00",
    "duration": 2880,
    "description": null,
    "privacy": "anybody"
  },
  {
    "id": "1122872955",
    "title": "Baptism of Parker Robertson (9/28/2025)",
    "url": "https://vimeo.com/1122872955",
    "date": "2025-09-29T14:19:05+00:00",
    "duration": 61,
    "description": null,
    "privacy": "anybody"
  },
  {
    "id": "1122868363",
    "title": "The Promised King: Conquers and Blesses (9/28/2025)",
    "url": "https://vimeo.com/1122868363",
    "date": "2025-09-29T14:07:10+00:00",
    "duration": 2237,
    "description": null,
    "privacy": "anybody"
  },
  {
    "id": "1120851097",
    "title": "The Promised King: Fulfills (9/21/2025)",
    "url": "https://vimeo.com/1120851097",
    "date": "2025-09-22T14:21:43+00:00",
    "duration": 2426,
    "description": null,
    "privacy": "anybody"
  },
  {
    "id": "1118762930",
    "title": "The Promised King: Waits & Worships (09/14/2025)",
    "url": "https://vimeo.com/1118762930",
    "date": "2025-09-15T14:30:24+00:00",
    "duration": 2608,
    "description": null,
    "privacy": "anybody"
  },
  {
    "id": "1117910542",
    "title": "Systematic Theology Class 4 - 9/10/25",
    "url": "https://vimeo.com/1117910542",
    "date": "2025-09-11T19:44:59+00:00",
    "duration": 3411,
    "description": null,
    "privacy": "anybody"
  },
  {
    "id": "1117893156",
    "title": "Who is Like Our God",
    "url": "https://vimeo.com/1117893156",
    "date": "2025-09-11T18:47:26+00:00",
    "duration": 197,
    "description": null,
    "privacy": "anybody"
  },
  {
    "id": "1117893141",
    "title": "Praise Pt. 2",
    "url": "https://vimeo.com/1117893141",
    "date": "2025-09-11T18:47:21+00:00",
    "duration": 76,
    "description": null,
    "privacy": "anybody"
  },
  {
    "id": "1117893113",
    "title": "Praise Pt. 1",
    "url": "https://vimeo.com/1117893113",
    "date": "2025-09-11T18:47:14+00:00",
    "duration": 120,
    "description": null,
    "privacy": "anybody"
  },
  {
    "id": "1117154051",
    "title": "The Joy",
    "url": "https://vimeo.com/1117154051",
    "date": "2025-09-09T15:47:23+00:00",
    "duration": 226,
    "description": null,
    "privacy": "anybody"
  },
  {
    "id": "1117154032",
    "title": "Act Justly, Love Mercy, Walk Humbly",
    "url": "https://vimeo.com/1117154032",
    "date": "2025-09-09T15:47:18+00:00",
    "duration": 121,
    "description": null,
    "privacy": "anybody"
  },
  {
    "id": "1116889077",
    "title": "The Promised King: Reigns (9/7/2025)",
    "url": "https://vimeo.com/1116889077",
    "date": "2025-09-08T19:40:39+00:00",
    "duration": 2413,
    "description": null,
    "privacy": "anybody"
  },
  {
    "id": "1116861727",
    "title": "The Promised King: Reign (9/7/2025)",
    "url": "https://vimeo.com/1116861727",
    "date": "2025-09-08T18:02:06+00:00",
    "duration": 25191,
    "description": null,
    "privacy": "anybody"
  },
  {
    "id": "1115230946",
    "title": "Baptism of Joseph (8/31/2025)",
    "url": "https://vimeo.com/1115230946",
    "date": "2025-09-02T16:49:05+00:00",
    "duration": 288,
    "description": null,
    "privacy": "anybody"
  },
  {
    "id": "1115181921",
    "title": "Previously On...He Shall Reign (8/31/2025)",
    "url": "https://vimeo.com/1115181921",
    "date": "2025-09-02T14:18:46+00:00",
    "duration": 2163,
    "description": null,
    "privacy": "anybody"
  },
  {
    "id": "1115179929",
    "title": "Baptism of Annie Madole (8/31/2025)",
    "url": "https://vimeo.com/1115179929",
    "date": "2025-09-02T14:12:54+00:00",
    "duration": 128,
    "description": null,
    "privacy": "anybody"
  },
  {
    "id": "1114048758",
    "title": "Systematic Theology Class 2 - Part 2 - 8/27/25",
    "url": "https://vimeo.com/1114048758",
    "date": "2025-08-28T20:36:53+00:00",
    "duration": 134,
    "description": null,
    "privacy": "anybody"
  },
  {
    "id": "1114029231",
    "title": "Systematic Theology Class 2 - Part 1 - 8/27/25",
    "url": "https://vimeo.com/1114029231",
    "date": "2025-08-28T19:28:43+00:00",
    "duration": 2150,
    "description": null,
    "privacy": "anybody"
  },
  {
    "id": "1113008138",
    "title": "For God So Loved",
    "url": "https://vimeo.com/1113008138",
    "date": "2025-08-25T19:38:41+00:00",
    "duration": 262,
    "description": null,
    "privacy": "anybody"
  },
  {
    "id": "1112982474",
    "title": "Family Discipleship Service (8/24/2025)",
    "url": "https://vimeo.com/1112982474",
    "date": "2025-08-25T18:08:49+00:00",
    "duration": 2998,
    "description": null,
    "privacy": "anybody"
  },
  {
    "id": "1112918436",
    "title": "Awakening to the Supremacy of Christ (8/24/2025)",
    "url": "https://vimeo.com/1112918436",
    "date": "2025-08-25T14:53:15+00:00",
    "duration": 2237,
    "description": null,
    "privacy": "anybody"
  },
  {
    "id": "1112904101",
    "title": "Baptism of Kinsey Foshee (8/24/2025)",
    "url": "https://vimeo.com/1112904101",
    "date": "2025-08-25T14:06:02+00:00",
    "duration": 112,
    "description": null,
    "privacy": "anybody"
  },
  {
    "id": "1112107071",
    "title": "The Baptism of Dennis Daniel (8/17/2025)",
    "url": "https://vimeo.com/1112107071",
    "date": "2025-08-21T20:46:00+00:00",
    "duration": 118,
    "description": null,
    "privacy": "anybody"
  },
  {
    "id": "1112095736",
    "title": "Systematic Theology Class 1 - 8/20/25",
    "url": "https://vimeo.com/1112095736",
    "date": "2025-08-21T20:00:34+00:00",
    "duration": 4987,
    "description": null,
    "privacy": "anybody"
  },
  {
    "id": "1111695690",
    "title": "Trust in God pt. 3",
    "url": "https://vimeo.com/1111695690",
    "date": "2025-08-20T15:18:10+00:00",
    "duration": 76,
    "description": null,
    "privacy": "anybody"
  },
  {
    "id": "1111695671",
    "title": "Trust in God pt. 2",
    "url": "https://vimeo.com/1111695671",
    "date": "2025-08-20T15:18:08+00:00",
    "duration": 119,
    "description": null,
    "privacy": "anybody"
  },
  {
    "id": "1111695631",
    "title": "Trust in God pt. 1",
    "url": "https://vimeo.com/1111695631",
    "date": "2025-08-20T15:18:02+00:00",
    "duration": 120,
    "description": null,
    "privacy": "anybody"
  },
  {
    "id": "1111678699",
    "title": "Happy Day",
    "url": "https://vimeo.com/1111678699",
    "date": "2025-08-20T14:27:17+00:00",
    "duration": 185,
    "description": null,
    "privacy": "anybody"
  },
  {
    "id": "1111024503",
    "title": "What He's Done! (8/17/25)",
    "url": "https://vimeo.com/1111024503",
    "date": "2025-08-18T16:48:34+00:00",
    "duration": 1917,
    "description": null,
    "privacy": "anybody"
  },
  {
    "id": "1109071810",
    "title": "Realigned: Christlike (8/10/25)",
    "url": "https://vimeo.com/1109071810",
    "date": "2025-08-11T14:33:37+00:00",
    "duration": 2413,
    "description": null,
    "privacy": "anybody"
  },
  {
    "id": "1107116641",
    "title": "Baptism of Bridgette Fudge (8/3/2025)",
    "url": "https://vimeo.com/1107116641",
    "date": "2025-08-04T14:57:02+00:00",
    "duration": 80,
    "description": null,
    "privacy": "anybody"
  },
  {
    "id": "1107115528",
    "title": "Baptism of Gage Randell (8/3/2025)",
    "url": "https://vimeo.com/1107115528",
    "date": "2025-08-04T14:53:49+00:00",
    "duration": 54,
    "description": null,
    "privacy": "anybody"
  },
  {
    "id": "1107108925",
    "title": "Realigned: Loving Your Enemies (8/3/2025)",
    "url": "https://vimeo.com/1107108925",
    "date": "2025-08-04T14:32:57+00:00",
    "duration": 2490,
    "description": null,
    "privacy": "anybody"
  },
  {
    "id": "1107086127",
    "title": "Kids Kamp 2025",
    "url": "https://vimeo.com/1107086127",
    "date": "2025-08-04T13:20:12+00:00",
    "duration": 108,
    "description": null,
    "privacy": "anybody"
  },
  {
    "id": "1106137266",
    "title": "Kids Kamp 2025 Day 3",
    "url": "https://vimeo.com/1106137266",
    "date": "2025-07-31T14:01:34+00:00",
    "duration": 289,
    "description": null,
    "privacy": "anybody"
  },
  {
    "id": "1105791481",
    "title": "Kids Kamp 2025 Day 2",
    "url": "https://vimeo.com/1105791481",
    "date": "2025-07-30T13:40:19+00:00",
    "duration": 249,
    "description": null,
    "privacy": "anybody"
  },
  {
    "id": "1105466561",
    "title": "Kids Kamp 2025 Day 1",
    "url": "https://vimeo.com/1105466561",
    "date": "2025-07-29T13:58:39+00:00",
    "duration": 145,
    "description": null,
    "privacy": "anybody"
  },
  {
    "id": "1105191608",
    "title": "Baptism of Henslee Tilley (7/27/2025)",
    "url": "https://vimeo.com/1105191608",
    "date": "2025-07-28T16:35:54+00:00",
    "duration": 112,
    "description": null,
    "privacy": "anybody"
  },
  {
    "id": "1105137219",
    "title": "Realigned: Humble (7/27/25)",
    "url": "https://vimeo.com/1105137219",
    "date": "2025-07-28T13:49:12+00:00",
    "duration": 2442,
    "description": null,
    "privacy": "anybody"
  },
  {
    "id": "1103146003",
    "title": "Realigned: Peacemaker (7/20/2025)",
    "url": "https://vimeo.com/1103146003",
    "date": "2025-07-21T14:10:59+00:00",
    "duration": 2435,
    "description": null,
    "privacy": "anybody"
  },
  {
    "id": "1101224690",
    "title": "Realigned: Hospitable (7/13/2025)",
    "url": "https://vimeo.com/1101224690",
    "date": "2025-07-14T14:09:10+00:00",
    "duration": 2377,
    "description": null,
    "privacy": "anybody"
  },
  {
    "id": "1101211520",
    "title": "Student Camp 2025",
    "url": "https://vimeo.com/1101211520",
    "date": "2025-07-14T13:26:27+00:00",
    "duration": 107,
    "description": null,
    "privacy": "anybody"
  },
  {
    "id": "1099360439",
    "title": "Realigned: Generous (7/6/2025)",
    "url": "https://vimeo.com/1099360439",
    "date": "2025-07-07T13:56:05+00:00",
    "duration": 2496,
    "description": null,
    "privacy": "anybody"
  },
  {
    "id": "1097534846",
    "title": "Realigned: Prayerful (6/29/2025)",
    "url": "https://vimeo.com/1097534846",
    "date": "2025-06-30T13:58:19+00:00",
    "duration": 867,
    "description": null,
    "privacy": "anybody"
  },
  {
    "id": "1077095758",
    "title": "Resurrection Day: Death to Life (4/20/2025)",
    "url": "https://vimeo.com/1077095758",
    "date": "2025-04-20T16:25:11+00:00",
    "duration": 1709,
    "description": null,
    "privacy": "anybody"
  },
  {
    "id": "1075107349",
    "title": "Palm Sunday: Hosanna to the Son of David (4/13/2025)",
    "url": "https://vimeo.com/1075107349",
    "date": "2025-04-13T17:43:45+00:00",
    "duration": 2247,
    "description": null,
    "privacy": "anybody"
  },
  {
    "id": "1072985030",
    "title": "He Shall Reign: The Final Battle (4/6/2025)",
    "url": "https://vimeo.com/1072985030",
    "date": "2025-04-06T16:57:21+00:00",
    "duration": 2335,
    "description": null,
    "privacy": "anybody"
  },
  {
    "id": "1071035030",
    "title": "He Shall Reign: The Lost Saul (3/30/2025)",
    "url": "https://vimeo.com/1071035030",
    "date": "2025-03-31T13:20:42+00:00",
    "duration": 2770,
    "description": null,
    "privacy": "anybody"
  },
  {
    "id": "1068858582",
    "title": "He Shall Reign: The Prodigal David (3/23/25)",
    "url": "https://vimeo.com/1068858582",
    "date": "2025-03-24T14:22:39+00:00",
    "duration": 2569,
    "description": null,
    "privacy": "anybody"
  },
  {
    "id": "1066340138",
    "title": "He Shall Reign: Where Are You? (3/16/2025)",
    "url": "https://vimeo.com/1066340138",
    "date": "2025-03-16T16:20:16+00:00",
    "duration": 2338,
    "description": null,
    "privacy": "anybody"
  },
  {
    "id": "1064167139",
    "title": "He Shall Reign: Wisdom Triumphs (3/9/2025)",
    "url": "https://vimeo.com/1064167139",
    "date": "2025-03-10T04:34:06+00:00",
    "duration": 2290,
    "description": null,
    "privacy": "anybody"
  },
  {
    "id": "1061787878",
    "title": "He Shall Reign: Vengeance Is Mine (3/2/2025)",
    "url": "https://vimeo.com/1061787878",
    "date": "2025-03-02T16:59:13+00:00",
    "duration": 2445,
    "description": null,
    "privacy": "anybody"
  },
  {
    "id": "1059482168",
    "title": "He Shall Reign: Providence & Deliverance (2/23/2025)",
    "url": "https://vimeo.com/1059482168",
    "date": "2025-02-23T17:08:00+00:00",
    "duration": 2251,
    "description": null,
    "privacy": "anybody"
  },
  {
    "id": "1057888210",
    "title": "He Shall Reign: Inquire of the Lord (2/16/2025)",
    "url": "https://vimeo.com/1057888210",
    "date": "2025-02-18T15:24:34+00:00",
    "duration": 2431,
    "description": null,
    "privacy": "anybody"
  },
  {
    "id": "1054980837",
    "title": "He Shall Reign: Turmoil & Tragedy (2/9/2025)",
    "url": "https://vimeo.com/1054980837",
    "date": "2025-02-09T16:51:24+00:00",
    "duration": 2157,
    "description": null,
    "privacy": "anybody"
  },
  {
    "id": "1053084950",
    "title": "He Shall Reign: Training Camp (2/2/2025)",
    "url": "https://vimeo.com/1053084950",
    "date": "2025-02-03T16:31:09+00:00",
    "duration": 2296,
    "description": null,
    "privacy": "anybody"
  },
  {
    "id": "1050527415",
    "title": "He Shall Reign: The Cost of Faithfulness (1/26/2025)",
    "url": "https://vimeo.com/1050527415",
    "date": "2025-01-26T17:09:37+00:00",
    "duration": 2216,
    "description": null,
    "privacy": "anybody"
  },
  {
    "id": "1048335232",
    "title": "He Shall Reign: In the Shadow of the Almighty (1/19/2025)",
    "url": "https://vimeo.com/1048335232",
    "date": "2025-01-19T17:07:00+00:00",
    "duration": 2325,
    "description": null,
    "privacy": "anybody"
  },
  {
    "id": "1046172865",
    "title": "He Shall Reign: The Difference Maker (1/12/2025)",
    "url": "https://vimeo.com/1046172865",
    "date": "2025-01-12T16:28:26+00:00",
    "duration": 2468,
    "description": null,
    "privacy": "anybody"
  },
  {
    "id": "1044183273",
    "title": "He Shall Reign: The Battle Is the Lord's (1/5/2025)",
    "url": "https://vimeo.com/1044183273",
    "date": "2025-01-06T01:39:00+00:00",
    "duration": 2741,
    "description": null,
    "privacy": "anybody"
  },
  {
    "id": "1043444502",
    "title": "The Psalms: Which Way Are You Headed? - Psalm 78 (12/29/2024)",
    "url": "https://vimeo.com/1043444502",
    "date": "2025-01-02T15:18:49+00:00",
    "duration": 2750,
    "description": null,
    "privacy": "anybody"
  },
  {
    "id": "1041534233",
    "title": "God With Us: Grace and Truth (12/22/2024)",
    "url": "https://vimeo.com/1041534233",
    "date": "2024-12-22T16:23:28+00:00",
    "duration": 2480,
    "description": null,
    "privacy": "anybody"
  },
  {
    "id": "1039426461",
    "title": "God With Us: Light (12/15/2024)",
    "url": "https://vimeo.com/1039426461",
    "date": "2024-12-15T17:04:00+00:00",
    "duration": 2563,
    "description": null,
    "privacy": "anybody"
  },
  {
    "id": "1037218887",
    "title": "God With Us: Life (12/8/2024)",
    "url": "https://vimeo.com/1037218887",
    "date": "2024-12-08T17:10:20+00:00",
    "duration": 2353,
    "description": null,
    "privacy": "anybody"
  },
  {
    "id": "1034961869",
    "title": "The Psalms: Restless Faith - Psalm 77 (12/01/2024)",
    "url": "https://vimeo.com/1034961869",
    "date": "2024-12-01T16:19:05+00:00",
    "duration": 2640,
    "description": null,
    "privacy": "anybody"
  },
  {
    "id": "1033123348",
    "title": "He Shall Reign: God's Presence Is Primary (11/24/2024)",
    "url": "https://vimeo.com/1033123348",
    "date": "2024-11-25T15:35:51+00:00",
    "duration": 2534,
    "description": null,
    "privacy": "anybody"
  },
  {
    "id": "1030496094",
    "title": "He Shall Reign: Obedience Matters (11/17/24)",
    "url": "https://vimeo.com/1030496094",
    "date": "2024-11-17T16:26:04+00:00",
    "duration": 2558,
    "description": null,
    "privacy": "anybody"
  },
  {
    "id": "1028912367",
    "title": "He Shall Reign: 7 Lessons from Ancient Teachers (11/10/2024)",
    "url": "https://vimeo.com/1028912367",
    "date": "2024-11-12T16:42:36+00:00",
    "duration": 2661,
    "description": null,
    "privacy": "anybody"
  },
  {
    "id": "1028892808",
    "title": "He Shall Reign: 7 Lessons from Saul & Jonathan",
    "url": "https://vimeo.com/1028892808",
    "date": "2024-11-12T15:52:24+00:00",
    "duration": 2661,
    "description": null,
    "privacy": "anybody"
  },
  {
    "id": "1025883773",
    "title": "He Shall Reign: Mighty to Save (11/3/2024)",
    "url": "https://vimeo.com/1025883773",
    "date": "2024-11-03T16:22:20+00:00",
    "duration": 2302,
    "description": null,
    "privacy": "anybody"
  },
  {
    "id": "1023722806",
    "title": "He Shall Reign: Trust and Obey (10/27/24)",
    "url": "https://vimeo.com/1023722806",
    "date": "2024-10-27T16:13:01+00:00",
    "duration": 2387,
    "description": null,
    "privacy": "anybody"
  },
  {
    "id": "1021757438",
    "title": "The Psalms: Fear the Lord - Psalm 76 (10/20/24)",
    "url": "https://vimeo.com/1021757438",
    "date": "2024-10-21T14:33:04+00:00",
    "duration": 2163,
    "description": null,
    "privacy": "anybody"
  },
  {
    "id": "1019161689",
    "title": "He Shall Reign: Return to Me (10/13/24)",
    "url": "https://vimeo.com/1019161689",
    "date": "2024-10-13T15:27:31+00:00",
    "duration": 2230,
    "description": null,
    "privacy": "anybody"
  },
  {
    "id": "1016762778",
    "title": "He Shall Reign: The Humble Savior (10/06/24)",
    "url": "https://vimeo.com/1016762778",
    "date": "2024-10-06T15:21:35+00:00",
    "duration": 2281,
    "description": null,
    "privacy": "anybody"
  },
  {
    "id": "1015014654",
    "title": "Dan Testimony",
    "url": "https://vimeo.com/1015014654",
    "date": "2024-10-01T22:28:39+00:00",
    "duration": 854,
    "description": null,
    "privacy": "anybody"
  },
  {
    "id": "1014446328",
    "title": "Chris Cross Testimony",
    "url": "https://vimeo.com/1014446328",
    "date": "2024-09-30T16:49:43+00:00",
    "duration": 2860,
    "description": null,
    "privacy": "anybody"
  },
  {
    "id": "1014044239",
    "title": "He Shall Reign: Lost Donkeys and a Found King (9/29/24)",
    "url": "https://vimeo.com/1014044239",
    "date": "2024-09-29T15:23:05+00:00",
    "duration": 2078,
    "description": null,
    "privacy": "anybody"
  },
  {
    "id": "1013168835",
    "title": "Trebor Nall Testimony",
    "url": "https://vimeo.com/1013168835",
    "date": "2024-09-26T13:58:39+00:00",
    "duration": 1128,
    "description": null,
    "privacy": "anybody"
  },
  {
    "id": "1011779562",
    "title": "He Shall Reign: Who Shall Reign? (09/22/24)",
    "url": "https://vimeo.com/1011779562",
    "date": "2024-09-22T15:33:15+00:00",
    "duration": 2042,
    "description": null,
    "privacy": "anybody"
  },
  {
    "id": "1009894759",
    "title": "He Shall Reign: The Weight of Glory (9/15/2024)",
    "url": "https://vimeo.com/1009894759",
    "date": "2024-09-16T14:49:40+00:00",
    "duration": 2105,
    "description": "Presented by John Wohlgemuth on September 15, 2024 at Henderson Hills Baptist Church in Edmond, Oklahoma. hhbc.com",
    "privacy": "anybody"
  },
  {
    "id": "1007707987",
    "title": "He Shall Reign: A Faithful Priest, and a Faithful Prophet (9/8/2024)",
    "url": "https://vimeo.com/1007707987",
    "date": "2024-09-09T15:11:32+00:00",
    "duration": 2078,
    "description": "Presented by John Wohlgemuth on September 8, 2024 at Henderson Hills Baptist Church in Edmond, Oklahoma. hhbc.com",
    "privacy": "anybody"
  },
  {
    "id": "1005140195",
    "title": "He Shall Reign: The Heartbeat of God (9/01/2024)",
    "url": "https://vimeo.com/1005140195",
    "date": "2024-09-01T15:44:10+00:00",
    "duration": 2099,
    "description": "Presented by Ryan Whitaker on September 1, 2024 at Henderson Hills Baptist Church in Edmond, Oklahoma. hhbc.com",
    "privacy": "anybody"
  },
  {
    "id": "1002431490",
    "title": "He Shall Reign: True Worship (8/25/2024)",
    "url": "https://vimeo.com/1002431490",
    "date": "2024-08-25T15:46:48+00:00",
    "duration": 2174,
    "description": "Presented by John Wohlgemuth on August 25, 2024 at Henderson Hills Baptist Church in Edmond, Oklahoma. hhbc.com",
    "privacy": "anybody"
  },
  {
    "id": "1000109408",
    "title": "He Shall Reign: The Fulfillment of Our Desires (8/18/2024)",
    "url": "https://vimeo.com/1000109408",
    "date": "2024-08-18T17:27:05+00:00",
    "duration": 2288,
    "description": "Presented by John Wohlgemuth on August 18, 2024 at Henderson Hills Baptist Church in Edmond, Oklahoma. hhbc.com",
    "privacy": "anybody"
  },
  {
    "id": "997466590",
    "title": "He Shall Reign: An Introduction to 1 Samuel (8/11/2024)",
    "url": "https://vimeo.com/997466590",
    "date": "2024-08-11T18:57:25+00:00",
    "duration": 2091,
    "description": "Presented by John Wohlgemuth on August 11, 2024 at Henderson Hills Baptist Church in Edmond, Oklahoma. hhbc.com",
    "privacy": "anybody"
  },
  {
    "id": "994811605",
    "title": "The Psalms: A Song of Justice - Psalm 75 (8/4/2024)",
    "url": "https://vimeo.com/994811605",
    "date": "2024-08-04T18:00:23+00:00",
    "duration": 2115,
    "description": "Presented by John Wohlgemuth on August 4, 2024 at Henderson Hills Baptist Church in Edmond, Oklahoma. hhbc.com",
    "privacy": "anybody"
  },
  {
    "id": "991195255",
    "title": "The Psalms: Certain Faith In Uncertain Times - Psalm 74 (7/28/2024)",
    "url": "https://vimeo.com/991195255",
    "date": "2024-07-28T15:44:44+00:00",
    "duration": 2501,
    "description": "Presented by Mark Callarman on July 28, 2024 at Henderson Hills Baptist Church in Edmond, Oklahoma. hhbc.com",
    "privacy": "anybody"
  },
  {
    "id": "988021078",
    "title": "The Psalms: A Crisis of Faith - Psalm 73 (7/21/2024)",
    "url": "https://vimeo.com/988021078",
    "date": "2024-07-21T15:48:01+00:00",
    "duration": 2507,
    "description": "Presented by Aaron Ferguson on July 21, 2024 at Henderson Hills Baptist Church in Edmond, Oklahoma. hhbc.com",
    "privacy": "anybody"
  },
  {
    "id": "983908846",
    "title": "The Psalms: The Ideal King - Psalm 72 (7/14/2024)",
    "url": "https://vimeo.com/983908846",
    "date": "2024-07-14T16:52:12+00:00",
    "duration": 2197,
    "description": "Presented by John Wohlgemuth on July 14, 2024 at Henderson Hills Baptist Church in Edmond, Oklahoma. hhbc.com",
    "privacy": "anybody"
  },
  {
    "id": "979979992",
    "title": "The Psalms: Start, Stay and Finish Strong! - Psalm 71 (7/7/2024)",
    "url": "https://vimeo.com/979979992",
    "date": "2024-07-07T15:44:03+00:00",
    "duration": 1750,
    "description": "Presented by Phil Sallee on July 7, 2024 at Henderson Hills Baptist Church in Edmond, Oklahoma. hhbc.com",
    "privacy": "anybody"
  },
  {
    "id": "972324531",
    "title": "The Psalms: O God, Do Not Delay! - Psalm 70 (6/30/2024)",
    "url": "https://vimeo.com/972324531",
    "date": "2024-06-30T16:13:02+00:00",
    "duration": 2379,
    "description": "Presented by John Wohlgemuth on June 30, 2024 at Henderson Hills Baptist Church in Edmond, Oklahoma. hhbc.com",
    "privacy": "anybody"
  },
  {
    "id": "965984011",
    "title": "The Psalms: The Suffering Servant - Psalm 69 (6/23/2024)",
    "url": "https://vimeo.com/965984011",
    "date": "2024-06-23T16:17:56+00:00",
    "duration": 2467,
    "description": "Presented by John Wohlgemuth on June 23, 2024 at Henderson Hills Baptist Church in Edmond, Oklahoma. hhbc.com",
    "privacy": "anybody"
  },
  {
    "id": "959647099",
    "title": "The Psalms: God's Triumph - Psalm 68 (6/16/2024)",
    "url": "https://vimeo.com/959647099",
    "date": "2024-06-16T16:06:30+00:00",
    "duration": 2494,
    "description": "Presented by John Wohlgemuth on June 16, 2024 at Henderson Hills Baptist Church in Edmond, Oklahoma. hhbc.com",
    "privacy": "anybody"
  },
  {
    "id": "955526589",
    "title": "The Psalms: Let The Nations Be Glad - Psalm 67 (6/9/2024)",
    "url": "https://vimeo.com/955526589",
    "date": "2024-06-09T15:44:12+00:00",
    "duration": 2342,
    "description": "Presented by John Wohlgemuth on June 9, 2024 at Henderson Hills Baptist Church in Edmond, Oklahoma. hhbc.com",
    "privacy": "anybody"
  },
  {
    "id": "952866413",
    "title": "The Psalms: Shout! Sing! Say! - Psalm 66 (6/2/2024)",
    "url": "https://vimeo.com/952866413",
    "date": "2024-06-02T15:43:55+00:00",
    "duration": 1857,
    "description": "Presented by T.R. Lewis on June 2, 2024 at Henderson Hills Baptist Church in Edmond, Oklahoma. hhbc.com",
    "privacy": "anybody"
  },
  {
    "id": "950520163",
    "title": "The Psalms: Praise the Savior and Sustainer - Psalm 65 (5/26/2024)",
    "url": "https://vimeo.com/950520163",
    "date": "2024-05-26T15:48:44+00:00",
    "duration": 2054,
    "description": "Presented by Perry Walker on May 26, 2024 at Henderson Hills Baptist Church in Edmond, Oklahoma. hhbc.com",
    "privacy": "anybody"
  },
  {
    "id": "948452724",
    "title": "Faithful: In Life (5/19/2024)",
    "url": "https://vimeo.com/948452724",
    "date": "2024-05-20T19:53:57+00:00",
    "duration": 2218,
    "description": "Presented by John Wohlgemuth on May 19, 2024 at Henderson Hills Baptist Church in Edmond, Oklahoma. hhbc.com",
    "privacy": "anybody"
  },
  {
    "id": "945531452",
    "title": "Faithful: In Victory (5/12/2024)",
    "url": "https://vimeo.com/945531452",
    "date": "2024-05-12T16:38:03+00:00",
    "duration": 1946,
    "description": "Presented by John Wohlgemuth on May 12, 2024 at Henderson Hills Baptist Church in Edmond, Oklahoma. hhbc.com",
    "privacy": "anybody"
  },
  {
    "id": "942997043",
    "title": "Faithful: In Leadership (5/5/2024)",
    "url": "https://vimeo.com/942997043",
    "date": "2024-05-05T16:57:57+00:00",
    "duration": 2229,
    "description": null,
    "privacy": "anybody"
  },
  {
    "id": "940872430",
    "title": "Faithful: 60th Anniversary (4/28/2024)",
    "url": "https://vimeo.com/940872430",
    "date": "2024-04-29T15:44:35+00:00",
    "duration": 783,
    "description": "Presented by John Wohlgemuth on April 28, 2024 at Henderson Hills Baptist Church in Edmond, Oklahoma. hhbc.com",
    "privacy": "anybody"
  },
  {
    "id": "937393015",
    "title": "Faithful: In Temptation (4/21/2024)",
    "url": "https://vimeo.com/937393015",
    "date": "2024-04-21T15:37:13+00:00",
    "duration": 1876,
    "description": "Presented by Branden Dillard on April 7, 2024 at Henderson Hills Baptist Church in Edmond, Oklahoma. hhbc.com",
    "privacy": "anybody"
  },
  {
    "id": "934521109",
    "title": "Faithful: In Sustaining (4/14/2024)",
    "url": "https://vimeo.com/934521109",
    "date": "2024-04-14T15:54:49+00:00",
    "duration": 2253,
    "description": "Presented by John Wohlgemuth on April 14, 2024 at Henderson Hills Baptist Church in Edmond, Oklahoma. hhbc.com",
    "privacy": "anybody"
  },
  {
    "id": "931779622",
    "title": "Faithful: In Power (4/7/2024)",
    "url": "https://vimeo.com/931779622",
    "date": "2024-04-07T17:16:53+00:00",
    "duration": 2322,
    "description": "Presented by John Wohlgemuth on April 7, 2024 at Henderson Hills Baptist Church in Edmond, Oklahoma. hhbc.com",
    "privacy": "anybody"
  },
  {
    "id": "929306277",
    "title": "Easter: He Is Risen! He Is Risen Indeed! (3/31/2024)",
    "url": "https://vimeo.com/929306277",
    "date": "2024-03-31T16:19:15+00:00",
    "duration": 2017,
    "description": "Presented by John Wohlgemuth on March 31, 2024 at Henderson Hills Baptist Church in Edmond, Oklahoma. hhbc.com",
    "privacy": "anybody"
  },
  {
    "id": "926851602",
    "title": "Palm Sunday: The Misunderstood Entry (3/24/2024)",
    "url": "https://vimeo.com/926851602",
    "date": "2024-03-24T16:17:02+00:00",
    "duration": 2236,
    "description": "Presented by John Wohlgemuth on March 24, 2024 at Henderson Hills Baptist Church in Edmond, Oklahoma. hhbc.com",
    "privacy": "anybody"
  },
  {
    "id": "924368694",
    "title": "The Psalms: From Fear to Faith - Psalm 64 (3/17/2024)",
    "url": "https://vimeo.com/924368694",
    "date": "2024-03-17T16:39:03+00:00",
    "duration": 2205,
    "description": "Presented by Mark Callarman on March 17, 2024 at Henderson Hills Baptist Church in Edmond, Oklahoma. hhbc.com",
    "privacy": "anybody"
  },
  {
    "id": "923389559",
    "title": "Digging Deeper - Christian Liberty",
    "url": "https://vimeo.com/923389559",
    "date": "2024-03-14T15:24:57+00:00",
    "duration": 3872,
    "description": null,
    "privacy": "anybody"
  },
  {
    "id": "922086773",
    "title": "Called 2 Love - Week 6",
    "url": "https://vimeo.com/922086773",
    "date": "2024-03-11T16:04:15+00:00",
    "duration": 4178,
    "description": null,
    "privacy": "anybody"
  },
  {
    "id": "921764728",
    "title": "First Things First: Christian Liberty (3/10/2024)",
    "url": "https://vimeo.com/921764728",
    "date": "2024-03-10T17:38:23+00:00",
    "duration": 2468,
    "description": "Presented by John Wohlgemuth on March 10, 2024 at Henderson Hills Baptist Church in Edmond, Oklahoma. hhbc.com",
    "privacy": "anybody"
  },
  {
    "id": "920547567",
    "title": "Digging Deeper - Reformed Theology",
    "url": "https://vimeo.com/920547567",
    "date": "2024-03-07T17:10:33+00:00",
    "duration": 3965,
    "description": null,
    "privacy": "anybody"
  },
  {
    "id": "919669343",
    "title": "Digging Deeper - Ecclesiology",
    "url": "https://vimeo.com/919669343",
    "date": "2024-03-05T16:30:11+00:00",
    "duration": 4116,
    "description": null,
    "privacy": "anybody"
  },
  {
    "id": "919369424",
    "title": "Called 2 Love - Week 5",
    "url": "https://vimeo.com/919369424",
    "date": "2024-03-04T23:54:44+00:00",
    "duration": 4178,
    "description": null,
    "privacy": "anybody"
  },
  {
    "id": "919365290",
    "title": "Called 2 Love - Week 4",
    "url": "https://vimeo.com/919365290",
    "date": "2024-03-04T23:37:37+00:00",
    "duration": 4577,
    "description": null,
    "privacy": "anybody"
  },
  {
    "id": "918939483",
    "title": "First Things First: Reformed Theology (3/3/2024)",
    "url": "https://vimeo.com/918939483",
    "date": "2024-03-03T21:16:29+00:00",
    "duration": 2528,
    "description": "Presented by John Wohlgemuth on March 3, 2024 at Henderson Hills Baptist Church in Edmond, Oklahoma. hhbc.com",
    "privacy": "anybody"
  },
  {
    "id": "916483338",
    "title": "First Things First: Ecclesiology (2/25/2024)",
    "url": "https://vimeo.com/916483338",
    "date": "2024-02-25T18:43:32+00:00",
    "duration": 2547,
    "description": "Presented by John Wohlgemuth on February 25, 2024 at Henderson Hills Baptist Church in Edmond, Oklahoma. hhbc.com",
    "privacy": "anybody"
  },
  {
    "id": "915649510",
    "title": "Digging Deeper - Last Things",
    "url": "https://vimeo.com/915649510",
    "date": "2024-02-22T17:16:37+00:00",
    "duration": 3940,
    "description": null,
    "privacy": "anybody"
  },
  {
    "id": "915343420",
    "title": "Called 2 Love - Week 3",
    "url": "https://vimeo.com/915343420",
    "date": "2024-02-21T21:38:50+00:00",
    "duration": 2898,
    "description": null,
    "privacy": "anybody"
  },
  {
    "id": "914213239",
    "title": "First Things First: Last Things (2/18/2024)",
    "url": "https://vimeo.com/914213239",
    "date": "2024-02-18T19:36:42+00:00",
    "duration": 2393,
    "description": "Presented by John Wohlgemuth on February 18, 2024 at Henderson Hills Baptist Church in Edmond, Oklahoma. hhbc.com",
    "privacy": "anybody"
  },
  {
    "id": "913382745",
    "title": "Digging Deeper - Salvation",
    "url": "https://vimeo.com/913382745",
    "date": "2024-02-15T16:43:54+00:00",
    "duration": 3890,
    "description": null,
    "privacy": "anybody"
  },
  {
    "id": "913345725",
    "title": "Digging Deeper - Humanity",
    "url": "https://vimeo.com/913345725",
    "date": "2024-02-15T15:07:02+00:00",
    "duration": 3724,
    "description": null,
    "privacy": "anybody"
  },
  {
    "id": "912369502",
    "title": "Called 2 Love - Week 2",
    "url": "https://vimeo.com/912369502",
    "date": "2024-02-12T20:40:37+00:00",
    "duration": 4671,
    "description": null,
    "privacy": "anybody"
  },
  {
    "id": "912046530",
    "title": "First Things First: Salvation (2/11/2024)",
    "url": "https://vimeo.com/912046530",
    "date": "2024-02-11T18:27:23+00:00",
    "duration": 2064,
    "description": "Presented by Aaron Ferguson on February 11, 2024 at Henderson Hills Baptist Church in Edmond, Oklahoma. hhbc.com",
    "privacy": "anybody"
  },
  {
    "id": "910946285",
    "title": "Called 2 Love - Week 1",
    "url": "https://vimeo.com/910946285",
    "date": "2024-02-07T19:55:40+00:00",
    "duration": 4778,
    "description": null,
    "privacy": "anybody"
  },
  {
    "id": "909817455",
    "title": "First Things First: Humanity (2/4/2024)",
    "url": "https://vimeo.com/909817455",
    "date": "2024-02-04T20:15:24+00:00",
    "duration": 2260,
    "description": "Presented by John Wohlgemuth on February 4, 2024 at Henderson Hills Baptist Church in Edmond, Oklahoma. hhbc.com",
    "privacy": "anybody"
  },
  {
    "id": "908762085",
    "title": "Digging Deeper - God the Son",
    "url": "https://vimeo.com/908762085",
    "date": "2024-02-01T18:10:17+00:00",
    "duration": 3821,
    "description": null,
    "privacy": "anybody"
  },
  {
    "id": "907214775",
    "title": "First Things First: God [Part 3- God the Son] (1/28/2024)",
    "url": "https://vimeo.com/907214775",
    "date": "2024-01-28T16:50:05+00:00",
    "duration": 2409,
    "description": "Presented by John Wohlgemuth on January 28, 2024 at Henderson Hills Baptist Church in Edmond, Oklahoma. hhbc.com",
    "privacy": "anybody"
  },
  {
    "id": "906437599",
    "title": "Digging Deeper - Trinity",
    "url": "https://vimeo.com/906437599",
    "date": "2024-01-25T17:00:01+00:00",
    "duration": 3974,
    "description": null,
    "privacy": "anybody"
  },
  {
    "id": "904956272",
    "title": "First Things First: God [Part 2- Trinity] (1/21/2024)",
    "url": "https://vimeo.com/904956272",
    "date": "2024-01-21T17:43:12+00:00",
    "duration": 2366,
    "description": "Presented by John Wohlgemuth on January 21, 2024 at Henderson Hills Baptist Church in Edmond, Oklahoma. hhbc.com",
    "privacy": "anybody"
  },
  {
    "id": "904161804",
    "title": "Digging Deeper - God's Attributes",
    "url": "https://vimeo.com/904161804",
    "date": "2024-01-18T17:29:32+00:00",
    "duration": 3796,
    "description": null,
    "privacy": "anybody"
  },
  {
    "id": "902766995",
    "title": "First Things First: God [Part 1 - Attributes] (1/14/2024)",
    "url": "https://vimeo.com/902766995",
    "date": "2024-01-14T20:11:03+00:00",
    "duration": 2465,
    "description": "Presented by John Wohlgemuth on January 14, 2024 at Henderson Hills Baptist Church in Edmond, Oklahoma. hhbc.com",
    "privacy": "anybody"
  },
  {
    "id": "901728361",
    "title": "Digging Deeper - Revelation",
    "url": "https://vimeo.com/901728361",
    "date": "2024-01-11T02:22:59+00:00",
    "duration": 4053,
    "description": null,
    "privacy": "anybody"
  },
  {
    "id": "900607003",
    "title": "First Things First: Revelation (1/7/2024)",
    "url": "https://vimeo.com/900607003",
    "date": "2024-01-07T20:37:19+00:00",
    "duration": 2330,
    "description": "Presented by John Wohlgemuth on January 7, 2024 at Henderson Hills Baptist Church in Edmond, Oklahoma. hhbc.com",
    "privacy": "anybody"
  },
  {
    "id": "898948431",
    "title": "Week of Prayer (12/31/2023)",
    "url": "https://vimeo.com/898948431",
    "date": "2023-12-31T21:24:52+00:00",
    "duration": 1446,
    "description": "Presented by John Wohlgemuth, Aaron Ferguson, and Craig McClain on December 24, 2023 at Henderson Hills Baptist Church in Edmond, Oklahoma. hhbc.com",
    "privacy": "anybody"
  },
  {
    "id": "897657116",
    "title": "Good News of Great Joy: Angels (12/24/2023)",
    "url": "https://vimeo.com/897657116",
    "date": "2023-12-25T00:51:01+00:00",
    "duration": 886,
    "description": "Presented by John Wohlgemuth on December 24, 2023 at Henderson Hills Baptist Church in Edmond, Oklahoma. hhbc.com",
    "privacy": "anybody"
  },
  {
    "id": "895614152",
    "title": "Good News of Great Joy: Simeon (12/17/2023)",
    "url": "https://vimeo.com/895614152",
    "date": "2023-12-17T20:30:17+00:00",
    "duration": 2310,
    "description": "Presented by John Wohlgemuth on December 17, 2023 at Henderson Hills Baptist Church in Edmond, Oklahoma. hhbc.com",
    "privacy": "anybody"
  },
  {
    "id": "893100487",
    "title": "Good News of Great Joy: Zechariah (12/10/2023)",
    "url": "https://vimeo.com/893100487",
    "date": "2023-12-10T19:09:24+00:00",
    "duration": 2494,
    "description": "Presented by John Wohlgemuth on December 10, 2023 at Henderson Hills Baptist Church in Edmond, Oklahoma. hhbc.com.",
    "privacy": "anybody"
  },
  {
    "id": "890866703",
    "title": "Good News of Great Joy: Mary (12/03/2023)",
    "url": "https://vimeo.com/890866703",
    "date": "2023-12-03T21:45:45+00:00",
    "duration": 2513,
    "description": "Presented by John Wohlgemuth on December 3, 2023 at Henderson Hills Baptist Church in Edmond, Oklahoma. hhbc.com",
    "privacy": "anybody"
  },
  {
    "id": "888750286",
    "title": "The Psalms: My Soul Thirsts for You - Psalm 63 (11/26/2023)",
    "url": "https://vimeo.com/888750286",
    "date": "2023-11-27T16:11:30+00:00",
    "duration": 1964,
    "description": "Presented by Mark Wood on November 26, 2023 at Henderson Hills Baptist Church in Edmond, Oklahoma. hhbc.com",
    "privacy": "anybody"
  },
  {
    "id": "886203695",
    "title": "Christ Above All: The Body of Christ (11/19/2023)",
    "url": "https://vimeo.com/886203695",
    "date": "2023-11-19T20:45:53+00:00",
    "duration": 2300,
    "description": "Presented by John Wohlgemuth on November 19, 2023 at Henderson Hills Baptist Church in Edmond, Oklahoma. hhbc.com",
    "privacy": "anybody"
  },
  {
    "id": "883749507",
    "title": "Christ Above All: The Mission of God (11/12/2023)",
    "url": "https://vimeo.com/883749507",
    "date": "2023-11-12T17:34:57+00:00",
    "duration": 2127,
    "description": "Presented by John Wohlgemuth on November 12, 2023 at Henderson Hills Baptist Church in Edmond, Oklahoma. hhbc.com",
    "privacy": "anybody"
  },
  {
    "id": "883599629",
    "title": "Gary_Henley_Memorial_1080",
    "url": "https://vimeo.com/883599629",
    "date": "2023-11-11T19:45:16+00:00",
    "duration": 7208,
    "description": null,
    "privacy": "anybody"
  },
  {
    "id": "881429406",
    "title": "Christ Above All: New-Creation Relationships (11/05/2023)",
    "url": "https://vimeo.com/881429406",
    "date": "2023-11-05T17:04:26+00:00",
    "duration": 2319,
    "description": "Presented by John Wohlgemuth on November 5, 2023 at Henderson Hills Baptist Church in Edmond, Oklahoma. hhbc.com",
    "privacy": "anybody"
  },
  {
    "id": "879150356",
    "title": "Christ Above All: Put On the New Self (10/29/2023)",
    "url": "https://vimeo.com/879150356",
    "date": "2023-10-29T15:35:06+00:00",
    "duration": 2350,
    "description": "Presented by John Wohlgemuth on October 29, 2023 at Henderson Hills Baptist Church in Edmond, Oklahoma. hhbc.com",
    "privacy": "anybody"
  },
  {
    "id": "876948106",
    "title": "Christ Above All: Put Off the Old Self (10/22/2023)",
    "url": "https://vimeo.com/876948106",
    "date": "2023-10-22T23:51:02+00:00",
    "duration": 2504,
    "description": "Presented by John Wohlgemuth on October 22, 2023 at Henderson Hills Baptist Church in Edmond, Oklahoma. hhbc.com",
    "privacy": "anybody"
  },
  {
    "id": "874555303",
    "title": "25 Years in Nicaragua (10/15/2023)",
    "url": "https://vimeo.com/874555303",
    "date": "2023-10-15T17:03:40+00:00",
    "duration": 2410,
    "description": "Presented by Javier Moraga on October 15, 2023 at Henderson Hills Baptist Church in Edmond, Oklahoma. hhbc.com",
    "privacy": "anybody"
  },
  {
    "id": "872327522",
    "title": "Christ Above All: A New Identity (10/08/2023)",
    "url": "https://vimeo.com/872327522",
    "date": "2023-10-08T16:58:33+00:00",
    "duration": 2471,
    "description": "Presented by John Wohlgemuth on October 8, 2023 at Henderson Hills Baptist Church in Edmond, Oklahoma. hhbc.com",
    "privacy": "anybody"
  },
  {
    "id": "871202747",
    "title": "CG Certification - Administrative Coordinator",
    "url": "https://vimeo.com/871202747",
    "date": "2023-10-04T19:50:18+00:00",
    "duration": 965,
    "description": null,
    "privacy": "anybody"
  },
  {
    "id": "870070182",
    "title": "Christ Above All: The Fulfillment of the Law (10/01/2023)",
    "url": "https://vimeo.com/870070182",
    "date": "2023-10-01T17:45:37+00:00",
    "duration": 2630,
    "description": "Presented by John Wohlgemuth on October 1, 2023 at Henderson Hills Baptist Church in Edmond, Oklahoma. hhbc.com",
    "privacy": "anybody"
  },
  {
    "id": "868941936",
    "title": "CG Certification- Mission Coordinator",
    "url": "https://vimeo.com/868941936",
    "date": "2023-09-27T23:15:48+00:00",
    "duration": 878,
    "description": null,
    "privacy": "anybody"
  },
  {
    "id": "867690130",
    "title": "Christ Above All: Walking in Christ (9/24/2023)",
    "url": "https://vimeo.com/867690130",
    "date": "2023-09-24T17:07:44+00:00",
    "duration": 2563,
    "description": "Presented by John Wohlgemuth on September 24, 2023 at Henderson Hills Baptist Church in Edmond, Oklahoma. hhbc.com",
    "privacy": "anybody"
  },
  {
    "id": "866410983",
    "title": "CG Certification - Outreach/Social Coordinator",
    "url": "https://vimeo.com/866410983",
    "date": "2023-09-20T15:13:57+00:00",
    "duration": 703,
    "description": null,
    "privacy": "anybody"
  },
  {
    "id": "865316488",
    "title": "Christ Above All- The Ministry of God (9/17/2023)",
    "url": "https://vimeo.com/865316488",
    "date": "2023-09-17T16:20:29+00:00",
    "duration": 2596,
    "description": "Presented by John Wohlgemuth on September 17, 2023 at Henderson Hills Baptist Church in Edmond, Oklahoma. hhbc.com",
    "privacy": "anybody"
  },
  {
    "id": "864144843",
    "title": "CG Certification - Prayer/Care Coordinator",
    "url": "https://vimeo.com/864144843",
    "date": "2023-09-13T19:43:31+00:00",
    "duration": 1249,
    "description": null,
    "privacy": "anybody"
  },
  {
    "id": "862934795",
    "title": "Christ Above All: The Supremacy of Christ (9/10/2023)",
    "url": "https://vimeo.com/862934795",
    "date": "2023-09-10T18:36:07+00:00",
    "duration": 2434,
    "description": "Presented by John Wohlgemuth on September 10, 2023 at Henderson Hills Baptist Church in Edmond, Oklahoma. hhbc.com",
    "privacy": "anybody"
  },
  {
    "id": "861811472",
    "title": "CG Certification - Director",
    "url": "https://vimeo.com/861811472",
    "date": "2023-09-06T21:32:10+00:00",
    "duration": 975,
    "description": null,
    "privacy": "anybody"
  },
  {
    "id": "861810010",
    "title": "CG Certification - Bible Teacher",
    "url": "https://vimeo.com/861810010",
    "date": "2023-09-06T21:25:51+00:00",
    "duration": 1120,
    "description": null,
    "privacy": "anybody"
  },
  {
    "id": "860665142",
    "title": "The Psalms: Trusting in a Trustworthy God - Psalm 62 (9/3/2023)",
    "url": "https://vimeo.com/860665142",
    "date": "2023-09-03T16:50:15+00:00",
    "duration": 1764,
    "description": "Presented by Perry on September 3, 2023 at Henderson Hills Baptist Church in Edmond, Oklahoma. hhbc.com",
    "privacy": "anybody"
  },
  {
    "id": "858405168",
    "title": "Christ Above All: Prayer (8/27/2023)",
    "url": "https://vimeo.com/858405168",
    "date": "2023-08-27T16:28:42+00:00",
    "duration": 2250,
    "description": "Presented by John Wohlgemuth on August 27, 2023 at Henderson Hills Baptist Church in Edmond, Oklahoma. hhbc.com",
    "privacy": "anybody"
  },
  {
    "id": "857283437",
    "title": "CG Certification - Vision Casting",
    "url": "https://vimeo.com/857283437",
    "date": "2023-08-23T20:15:59+00:00",
    "duration": 713,
    "description": null,
    "privacy": "anybody"
  },
  {
    "id": "856223343",
    "title": "Christ Above All: Thanksgiving (8-20-2023)",
    "url": "https://vimeo.com/856223343",
    "date": "2023-08-20T19:22:49+00:00",
    "duration": 2341,
    "description": "Presented by John Wohlgemuth on August 20, 2023 at Henderson Hills Baptist Church in Edmond, Oklahoma. hhbc.com",
    "privacy": "anybody"
  },
  {
    "id": "854159531",
    "title": "Christ Above All: Introduction (8/13/2023)",
    "url": "https://vimeo.com/854159531",
    "date": "2023-08-13T17:30:11+00:00",
    "duration": 2414,
    "description": "Presented by John Wohlgemuth on August 13, 2023 at Henderson Hills Baptist Church in Edmond, Oklahoma. hhbc.com",
    "privacy": "anybody"
  },
  {
    "id": "852134744",
    "title": "Serve Sunday: Serving (8/6/2023)",
    "url": "https://vimeo.com/852134744",
    "date": "2023-08-06T17:44:08+00:00",
    "duration": 2443,
    "description": "Presented by John Wohlegemuth on August 6, 2023 at Henderson Hills Baptist Church in Edmond, Oklahoma. hhbc.com",
    "privacy": "anybody"
  },
  {
    "id": "849922056",
    "title": "Resting In Jesus: Jesus Is Our Rest (7/30/2023)",
    "url": "https://vimeo.com/849922056",
    "date": "2023-07-30T16:10:40+00:00",
    "duration": 2542,
    "description": "Presented by John Wohlegemuth on July 23, 2023 at Henderson Hills Baptist Church in Edmond, Oklahoma. hhbc.com",
    "privacy": "anybody"
  },
  {
    "id": "847804918",
    "title": "Love Jesus | Live Sent: Our Mission (7/23/2023)",
    "url": "https://vimeo.com/847804918",
    "date": "2023-07-23T20:53:15+00:00",
    "duration": 2540,
    "description": "Presented by John Wohlgemuth on July 23, 2023 at Henderson Hills Baptist Church in Edmond, Oklahoma. hhbc.com",
    "privacy": "anybody"
  },
  {
    "id": "845778931",
    "title": "The Psalms: Far Away From Home - Psalm 61 (7/16/2023)",
    "url": "https://vimeo.com/845778931",
    "date": "2023-07-17T01:07:59+00:00",
    "duration": 2206,
    "description": "Presented by Allen Rice on July 16, 2023 at Henderson Hills Baptist Church in Edmond, Oklahoma. hhbc.com",
    "privacy": "anybody"
  },
  {
    "id": "843689996",
    "title": "The Psalms: Nissi - Psalm 60 (7-9-2023)",
    "url": "https://vimeo.com/843689996",
    "date": "2023-07-09T19:45:51+00:00",
    "duration": 2870,
    "description": "Presented by Ryan Whitaker on July 9, 2023 at Henderson Hills Baptist Church in Edmond Oklahoma. hhbc.com",
    "privacy": "anybody"
  },
  {
    "id": "841657675",
    "title": "The Psalms: Bad Guys - Good God - Psalms 59 (7/02/2023)",
    "url": "https://vimeo.com/841657675",
    "date": "2023-07-02T17:00:34+00:00",
    "duration": 1791,
    "description": "Presented by Brent McCoy on July 2, 2023 at Henderson Hills Baptist Church in Edmond, Oklahoma. hhbc.com",
    "privacy": "anybody"
  },
  {
    "id": "839489477",
    "title": "The Psalms: Imminent Justice - Psalms 58 (6/25/2023)",
    "url": "https://vimeo.com/839489477",
    "date": "2023-06-25T17:03:06+00:00",
    "duration": 1767,
    "description": "Presented by Jimmy Quinn on June 25, 2023 at Henderson Hills Baptist Church in Edmond, Oklahoma. hhbc.com",
    "privacy": "anybody"
  },
  {
    "id": "838746293",
    "title": "061123 Weekend Review",
    "url": "https://vimeo.com/838746293",
    "date": "2023-06-22T16:57:13+00:00",
    "duration": 1112,
    "description": null,
    "privacy": "anybody"
  },
  {
    "id": "837349343",
    "title": "The Psalms: Faithful Refuge - Psalms 57 (6/18/2023)",
    "url": "https://vimeo.com/837349343",
    "date": "2023-06-18T16:49:11+00:00",
    "duration": 2120,
    "description": "Presented by Branden Dillard on June 18, 2023 at Henderson Hills Baptist Church in Edmond, Oklahoma. hhbc.com",
    "privacy": "anybody"
  },
  {
    "id": "835202793",
    "title": "The Psalms: From Danger to Deliverance - Psalms 56 (6/11/2023)",
    "url": "https://vimeo.com/835202793",
    "date": "2023-06-11T16:29:14+00:00",
    "duration": 1841,
    "description": "Presented by Phil Sallee on June 11, 2023 at Henderson Hills Baptist Church in Edmond, Oklahoma. hhbc.com",
    "privacy": "anybody"
  },
  {
    "id": "833089229",
    "title": "The Psalms: Deliver Me from Distraction - Psalms 55 (6/04/2023)",
    "url": "https://vimeo.com/833089229",
    "date": "2023-06-04T17:33:58+00:00",
    "duration": 1574,
    "description": "Presented by Bill Liggett on June 4, 2023 at Henderson Hills Baptist Church in Edmond, Oklahoma. hhbc.com",
    "privacy": "anybody"
  },
  {
    "id": "831010033",
    "title": "Who is the Holy Spirit: Pentacost - Acts 2:1-13 (5/28/2023)",
    "url": "https://vimeo.com/831010033",
    "date": "2023-05-28T17:12:02+00:00",
    "duration": 2117,
    "description": "Presented by T. R. Lewis on May 28, 2023 at Henderson Hills Baptist Church in Edmond, Oklahoma. hhbc.com",
    "privacy": "anybody"
  },
  {
    "id": "828798538",
    "title": "The Judge is Coming: Joel 3:1-16 (5/21/2023)",
    "url": "https://vimeo.com/828798538",
    "date": "2023-05-21T17:09:19+00:00",
    "duration": 2460,
    "description": "Presented by Heath Thomas on May 21, 2023 at Henderson Hills Baptist Church in Edmond, Oklahoma. hhbc.com",
    "privacy": "anybody"
  },
  {
    "id": "826672558",
    "title": "Knowing God: Joel 3:17-21 (5/14/2023)",
    "url": "https://vimeo.com/826672558",
    "date": "2023-05-14T17:01:21+00:00",
    "duration": 2808,
    "description": "Presented by Heath Thomas on May 14, 2023 at Henderson Hills Baptist Church in Edmond, Oklahoma. hhbc.com",
    "privacy": "anybody"
  },
  {
    "id": "824535702",
    "title": "A Call that Saves: Joel 2:28-32 (5/07/2023)",
    "url": "https://vimeo.com/824535702",
    "date": "2023-05-07T16:16:19+00:00",
    "duration": 2210,
    "description": "Presented by Heath Thomas on May 7, 2023 at Henderson Hills Baptist Church in Edmond, Oklahoma. hhbc.com",
    "privacy": "anybody"
  },
  {
    "id": "822534295",
    "title": "Dark Stars, Deep Cries and Divine Grace: Joel 2:1-27 (4/30/2023)",
    "url": "https://vimeo.com/822534295",
    "date": "2023-04-30T20:00:19+00:00",
    "duration": 3143,
    "description": "Presented by Heath Thomas on April 30, 2023 at Henderson Hills Baptist Church in Edmond, Oklahoma. hhbc.com",
    "privacy": "anybody"
  },
  {
    "id": "820289308",
    "title": "Lessons from Locusts: Joel 1:1-20 (4/23/2023)",
    "url": "https://vimeo.com/820289308",
    "date": "2023-04-23T16:54:48+00:00",
    "duration": 2458,
    "description": "Presented by Heath Thomas on April 23, 2023 at Henderson Hills Baptist Church in Edmond, Oklahoma. hhbc.com",
    "privacy": "anybody"
  },
  {
    "id": "818140695",
    "title": "The Importance of Christ's Ascension - Acts 1:1-11(4/16/2023)",
    "url": "https://vimeo.com/818140695",
    "date": "2023-04-16T17:38:33+00:00",
    "duration": 2334,
    "description": "Presented by John Wohlgemuth on April 16, 2023 at Henderson Hills Baptist Church in Edmond, Oklahoma. hhbc.com",
    "privacy": "anybody"
  },
  {
    "id": "816043450",
    "title": "That You May Believe: The Gospel According to John - John 18-21 (4/09/2023)",
    "url": "https://vimeo.com/816043450",
    "date": "2023-04-09T18:03:40+00:00",
    "duration": 2315,
    "description": "Presented by John Wohlgemuth on April 9, 2023 at Henderson Hills Baptist Church in Edmond, Oklahoma. hhbc.com",
    "privacy": "anybody"
  },
  {
    "id": "814017163",
    "title": "That You May Believe: The Gospel According to Mark - Mark 14-16 (4-02-2023)",
    "url": "https://vimeo.com/814017163",
    "date": "2023-04-02T16:41:10+00:00",
    "duration": 2426,
    "description": "Presented by John Wohlgemuth on April 02, 2023 at Henderson Hills Baptist Church in Edmond, Oklahoma. hhbc.com",
    "privacy": "anybody"
  },
  {
    "id": "812075319",
    "title": "That You May Believe: The Gospel According to Matthew - Matthew 27:6228:15 (3-26-2023)",
    "url": "https://vimeo.com/812075319",
    "date": "2023-03-27T15:10:03+00:00",
    "duration": 2287,
    "description": "Presented by John Wohlgemuth on March 26, 2023 at Henderson Hills Baptist Church in Edmond, Oklahoma. hhbc.com",
    "privacy": "anybody"
  },
  {
    "id": "809517604",
    "title": "The Psalms: Desperate and Dependent - Psalms 54 (3/19/2023)",
    "url": "https://vimeo.com/809517604",
    "date": "2023-03-19T16:37:22+00:00",
    "duration": 2318,
    "description": "Presented by Craig McClain on March 19, 2023 at Henderson Hills Baptist Church in Edmond, Oklahoma. hhbc.com",
    "privacy": "anybody"
  },
  {
    "id": "807261876",
    "title": "The Psalms: The Shame of the Fool - Psalms 53 (3/12/2023)",
    "url": "https://vimeo.com/807261876",
    "date": "2023-03-12T16:19:15+00:00",
    "duration": 2330,
    "description": "Presented by John Wohlgemuth on March 12, 2023 at Henderson Hills Baptist Church in Edmond, Oklahoma. hhbc.com",
    "privacy": "anybody"
  },
  {
    "id": "806421770",
    "title": "Culture Wars: Climate Change (3-08-2023)",
    "url": "https://vimeo.com/806421770",
    "date": "2023-03-09T16:51:38+00:00",
    "duration": 4151,
    "description": "Presented by Phil Sallee on March 08, 2023 at Henderson Hills Baptist Church in Edmond, Oklahoma. hhbc.com",
    "privacy": "anybody"
  },
  {
    "id": "804887022",
    "title": "His Very Own: Closing Thoughts - Titus 3:12-15 (03-05-2023)",
    "url": "https://vimeo.com/804887022",
    "date": "2023-03-05T17:47:27+00:00",
    "duration": 2117,
    "description": "Presented by John Wohlgemuth on March 05, 2023 at Henderson Hills Baptist Church in Edmond, Oklahoma. hhbc.com",
    "privacy": "anybody"
  },
  {
    "id": "804859858",
    "title": "Culture Wars: Religious Liberty (3-01-2023)",
    "url": "https://vimeo.com/804859858",
    "date": "2023-03-05T15:37:39+00:00",
    "duration": 4107,
    "description": "Presented by Phil Sallee and Dr. Bruce Ashford on March 01, 2023 at Henderson Hills Baptist Church in Edmond, Oklahoma. hhbc.com",
    "privacy": "anybody"
  },
  {
    "id": "802480107",
    "title": "His Very Own: Discipline - Titus 3:9-11 (2-26-2023)",
    "url": "https://vimeo.com/802480107",
    "date": "2023-02-26T19:50:44+00:00",
    "duration": 2398,
    "description": "Presented by John Wohlgemuth on February 26th, 2023 at Henderson Hills Baptist Church in Edmond, Oklahoma. hhbc.com",
    "privacy": "anybody"
  },
  {
    "id": "801608480",
    "title": "Culture Wars: Racism (2-22-23)",
    "url": "https://vimeo.com/801608480",
    "date": "2023-02-23T14:30:41+00:00",
    "duration": 4631,
    "description": "Presented by Phil Sallee, Joe Williams, Tasia Mendiola - Counselor and managing director at Pathways to Haven (OKC), John-Mark Hart - Pastor of Redemption Church, Jared Stevenson - Minister at Redemption Church, and Chauncey Shillow - Minister at Redemption Church on February 22, 2023 at Henderson Hills Baptist Church in Edmond, Oklahoma. hhbc.com",
    "privacy": "anybody"
  },
  {
    "id": "800682538",
    "title": "His Very Own: Good Works - Titus 3:1-8 (2-19-2023)",
    "url": "https://vimeo.com/800682538",
    "date": "2023-02-20T23:00:51+00:00",
    "duration": 2741,
    "description": "Presented by John Wohlgemuth on February 19th, 2023 at Henderson Hills Baptist Church in Edmond, Oklahoma. hhbc.com",
    "privacy": "anybody"
  },
  {
    "id": "799517011",
    "title": "Culture Wars: LGBTQ+ (2-15-2023)",
    "url": "https://vimeo.com/799517011",
    "date": "2023-02-16T15:32:26+00:00",
    "duration": 4868,
    "description": "Presented by Stephen Black of First Stone on February 15st, 2023 at Henderson Hills Baptist Church in Edmond, Oklahoma. hhbc.com",
    "privacy": "anybody"
  },
  {
    "id": "799284770",
    "title": "Our Story in Light of God's Story (2-8-2023)",
    "url": "https://vimeo.com/799284770",
    "date": "2023-02-15T22:10:11+00:00",
    "duration": 4982,
    "description": "Presented by Dr. Matthew Emerson on February 8th, 2023 at Henderson Hills Baptist Church in Edmond, Oklahoma. hhbc.com",
    "privacy": "anybody"
  },
  {
    "id": "798566714",
    "title": "His Very Own: Purity - Titus 2:11-15 (2-12-23)",
    "url": "https://vimeo.com/798566714",
    "date": "2023-02-13T23:21:54+00:00",
    "duration": 2978,
    "description": null,
    "privacy": "anybody"
  },
  {
    "id": "796101057",
    "title": "His Very Own: Discipling Women - Titus 2:1-10 (2-5-2023)",
    "url": "https://vimeo.com/796101057",
    "date": "2023-02-05T21:49:54+00:00",
    "duration": 2364,
    "description": "Presented by John Wohlgemuth on February 5th, 2023 at Henderson Hills Baptist Church in Edmond, Oklahoma. hhbc.com",
    "privacy": "anybody"
  },
  {
    "id": "795342323",
    "title": "Our Story in Light of God's Story: Redemption Promised & Pictured - The Story of Israel (2-1-2023)",
    "url": "https://vimeo.com/795342323",
    "date": "2023-02-02T18:57:42+00:00",
    "duration": 4043,
    "description": "Presented by Dr. Matthew Emerson on February 1st, 2023 at Henderson Hills Baptist Church in Edmond, Oklahoma. hhbc.com",
    "privacy": "anybody"
  },
  {
    "id": "793897800",
    "title": "His Very Own: Discipling Men - Titus 2:1-10 (1-29-2023)",
    "url": "https://vimeo.com/793897800",
    "date": "2023-01-29T19:39:33+00:00",
    "duration": 2525,
    "description": "Presented by John Wohlgemuth on January 29th, 2023 at Henderson Hills Baptist Church in Edmond, Oklahoma. hhbc.com",
    "privacy": "anybody"
  },
  {
    "id": "791670363",
    "title": "His Very Own: Truth - Titus 1:10-16 (1-22-2023)",
    "url": "https://vimeo.com/791670363",
    "date": "2023-01-22T19:00:53+00:00",
    "duration": 2198,
    "description": "Presented by John Wohlgemuth on January 22nd, 2023 at Henderson Hills Baptist Church in Edmond, Oklahoma. hhbc.com",
    "privacy": "anybody"
  },
  {
    "id": "791665682",
    "title": "Our Story in Light of God's Story: Creation & Fall (1-18-2023)",
    "url": "https://vimeo.com/791665682",
    "date": "2023-01-22T18:37:16+00:00",
    "duration": 4028,
    "description": "Presented by Dr. Matthew Emerson on January 18th, 2023 at Henderson Hills Baptist Church in Edmond, Oklahoma. hhbc.com",
    "privacy": "anybody"
  },
  {
    "id": "789508385",
    "title": "Night of Worship (1-11-2023)",
    "url": "https://vimeo.com/789508385",
    "date": "2023-01-15T19:47:09+00:00",
    "duration": 3350,
    "description": null,
    "privacy": "anybody"
  },
  {
    "id": "789490761",
    "title": "His Very Own: Elders - Titus 1:5-9 (1-15-2023)",
    "url": "https://vimeo.com/789490761",
    "date": "2023-01-15T18:09:04+00:00",
    "duration": 2728,
    "description": "Presented by Ryan Whitaker on January 15th, 2023 at Henderson Hills Baptist Church in Edmond, Oklahoma. hhbc.com",
    "privacy": "anybody"
  },
  {
    "id": "787364903",
    "title": "His Very Own: Gospel Introductions - Titus 1:1-4 (1-8-2023)",
    "url": "https://vimeo.com/787364903",
    "date": "2023-01-08T18:42:27+00:00",
    "duration": 2466,
    "description": "Presented by John Wohlgemuth on January 8th, 2023 at Henderson Hills Baptist Church in Edmond, Oklahoma. hhbc.com",
    "privacy": "anybody"
  },
  {
    "id": "785603218",
    "title": "A Week of Prayer: Solemn Assembly - Joel 2:12-17 (1-1-2023)",
    "url": "https://vimeo.com/785603218",
    "date": "2023-01-01T21:58:41+00:00",
    "duration": 3589,
    "description": "Presented by John Wohlgemuth on January 1st, 2023 at Henderson Hills Baptist Church in Edmond, Oklahoma. hhbc.com",
    "privacy": "anybody"
  },
  {
    "id": "784427019",
    "title": "Christmas Eve Service (12-24-2022)",
    "url": "https://vimeo.com/784427019",
    "date": "2022-12-26T21:41:27+00:00",
    "duration": 3748,
    "description": null,
    "privacy": "anybody"
  },
  {
    "id": "782316681",
    "title": "Advent: Love - 1 John 4:7-12 (12-18-2022)",
    "url": "https://vimeo.com/782316681",
    "date": "2022-12-18T20:01:40+00:00",
    "duration": 2719,
    "description": "Presented by John Wohlgemuth on December 18th, 2022 at Henderson Hills Baptist Church in Edmond, Oklahoma. hhbc.com",
    "privacy": "anybody"
  },
  {
    "id": "780206152",
    "title": "Deacon Ordination (12-7-2022)",
    "url": "https://vimeo.com/780206152",
    "date": "2022-12-12T00:42:06+00:00",
    "duration": 3823,
    "description": null,
    "privacy": "anybody"
  },
  {
    "id": "780148394",
    "title": "Advent: Joy - Luke 2:8-20 (12-11-2022)",
    "url": "https://vimeo.com/780148394",
    "date": "2022-12-11T18:39:06+00:00",
    "duration": 2420,
    "description": "Presented by John Wohlgemuth on December 11th, 2022 at Henderson Hills Baptist Church in Edmond, Oklahoma. hhbc.com",
    "privacy": "anybody"
  },
  {
    "id": "777867367",
    "title": "Advent: Peace - Ephesians 2:11-22 (12-4-2022)",
    "url": "https://vimeo.com/777867367",
    "date": "2022-12-04T18:39:51+00:00",
    "duration": 2692,
    "description": "Presented by John Wohlgemuth on December 4th, 2022 at Henderson Hills Baptist Church in Edmond, Oklahoma. hhbc.com",
    "privacy": "anybody"
  },
  {
    "id": "777102457",
    "title": "Advent: Hope - Matthew 12:15-21 (11-30-2022)",
    "url": "https://vimeo.com/777102457",
    "date": "2022-12-01T19:18:31+00:00",
    "duration": 1446,
    "description": "Presented by John Wohlgemuth on November 30th, 2022 at Henderson Hills Baptist Church in Edmond, Oklahoma. hhbc.com",
    "privacy": "anybody"
  },
  {
    "id": "775537505",
    "title": "The Psalms: God's Faithfulness Endures Forever! - Psalm 52 (11-27-2022)",
    "url": "https://vimeo.com/775537505",
    "date": "2022-11-27T18:13:58+00:00",
    "duration": 1945,
    "description": "Presented by Branden Dillard on November 27th, 2022 at Henderson Hills Baptist Church in Edmond, Oklahoma. hhbc.com",
    "privacy": "anybody"
  },
  {
    "id": "773089990",
    "title": "12. Disciple Making 101: How to Multiply Disciples: Multiply Your Life (11-16-2022)",
    "url": "https://vimeo.com/773089990",
    "date": "2022-11-20T20:07:16+00:00",
    "duration": 2544,
    "description": "Presented by Phil Sallee on November 16th, 2022 at Henderson Hills Baptist Church in Edmond, Oklahoma. hhbc.com",
    "privacy": "anybody"
  },
  {
    "id": "773076572",
    "title": "Who Can Ascend: God is Salvation - Micah 7:18-20 (11-20-2022)",
    "url": "https://vimeo.com/773076572",
    "date": "2022-11-20T18:57:41+00:00",
    "duration": 2083,
    "description": "Presented by John Wohlgemuth on November 20th, 2022 at Henderson Hills Baptist Church in Edmond, Oklahoma. hhbc.com",
    "privacy": "anybody"
  },
  {
    "id": "770504156",
    "title": "Who Can Ascend: Tell of God's Salvation - Micah 7:11-17 (11-13-2022)",
    "url": "https://vimeo.com/770504156",
    "date": "2022-11-13T21:03:26+00:00",
    "duration": 2573,
    "description": "Presented by John Wohlgemuth on November 13th, 2022 at Henderson Hills Baptist Church in Edmond, Oklahoma. hhbc.com",
    "privacy": "anybody"
  },
  {
    "id": "770480832",
    "title": "11. Disciple Making 101: How to Multiply Disciples: The Holy Spirit's Role (11-9-2022)",
    "url": "https://vimeo.com/770480832",
    "date": "2022-11-13T19:12:39+00:00",
    "duration": 1470,
    "description": "Presented by Phil Sallee on November 9th, 2022 at Henderson Hills Baptist Church in Edmond, Oklahoma. hhbc.com",
    "privacy": "anybody"
  },
  {
    "id": "767872416",
    "title": "10. Disciple Making 101: Make Time for What Matters Most (11-2-2022)",
    "url": "https://vimeo.com/767872416",
    "date": "2022-11-06T20:35:28+00:00",
    "duration": 1346,
    "description": "Presented by Phil Sallee on November 2nd, 2022 at Henderson Hills Baptist Church in Edmond, Oklahoma. hhbc.com",
    "privacy": "anybody"
  },
  {
    "id": "767843718",
    "title": "Who Can Ascend: Wait for God's Salvation - Micah 7:1-10 (11-6-2022)",
    "url": "https://vimeo.com/767843718",
    "date": "2022-11-06T18:08:39+00:00",
    "duration": 2257,
    "description": "Presented by John Wohlgemuth on November 6th, 2022 at Henderson Hills Baptist Church in Edmond, Oklahoma. hhbc.com",
    "privacy": "anybody"
  },
  {
    "id": "765495693",
    "title": "9. Disciple Making 101: Launch a Group (10-26-2022)",
    "url": "https://vimeo.com/765495693",
    "date": "2022-10-30T20:17:17+00:00",
    "duration": 1080,
    "description": "Presented by John Wohlgemuth on October 26th, 2022 at Henderson Hills Baptist Church in Edmond, Oklahoma. hhbc.com",
    "privacy": "anybody"
  },
  {
    "id": "765491084",
    "title": "Who Can Ascend: Explanation of Judgment - Micah 6:9-16 (10-30-2022)",
    "url": "https://vimeo.com/765491084",
    "date": "2022-10-30T19:50:03+00:00",
    "duration": 2460,
    "description": "Presented by John Wohlgemuth on October 30th, 2022 at Henderson Hills Baptist Church in Edmond, Oklahoma. hhbc.com",
    "privacy": "anybody"
  },
  {
    "id": "763156628",
    "title": "8. Disciple Making 101: Cast the Vision (10-19-2022)",
    "url": "https://vimeo.com/763156628",
    "date": "2022-10-23T18:02:12+00:00",
    "duration": 1383,
    "description": "Presented by Phil Sallee on October 19th, 2022 at Henderson Hills Baptist Church in Edmond, Oklahoma. hhbc.com",
    "privacy": "anybody"
  },
  {
    "id": "763146797",
    "title": "Who Can Ascend: God's Standard - Micah 6:1-8 (10-23-2022)",
    "url": "https://vimeo.com/763146797",
    "date": "2022-10-23T17:09:57+00:00",
    "duration": 2339,
    "description": "Presented by John Wohlgemuth on October 23rd, 2022 at Henderson Hills Baptist Church in Edmond, Oklahoma. hhbc.com",
    "privacy": "anybody"
  },
  {
    "id": "760824990",
    "title": "The Psalms: I've Sinned, Now What? - Psalm 51 (10-16-2022)",
    "url": "https://vimeo.com/760824990",
    "date": "2022-10-16T18:45:29+00:00",
    "duration": 2369,
    "description": "Presented by Aaron Ferguson on October 16th, 2022 at Henderson Hills Baptist Church in Edmond, Oklahoma. hhbc.com",
    "privacy": "anybody"
  },
  {
    "id": "758499700",
    "title": "Who Can Ascend: A Holy Nation - Micah 5:5b-15 (10-9-2022)",
    "url": "https://vimeo.com/758499700",
    "date": "2022-10-09T18:16:34+00:00",
    "duration": 2384,
    "description": "Presented by John Wohlgemuth on October 9th, 2022 at Henderson Hills Baptist Church in Edmond, Oklahoma. hhbc.com",
    "privacy": "anybody"
  },
  {
    "id": "758493382",
    "title": "7. Disciple Making 101: Choose Disciples Wisely (10-5-2022)",
    "url": "https://vimeo.com/758493382",
    "date": "2022-10-09T17:44:01+00:00",
    "duration": 1727,
    "description": "Presented by Phil Sallee on October 5th, 2022 at Henderson Hills Baptist Church in Edmond, Oklahoma. hhbc.com",
    "privacy": "anybody"
  },
  {
    "id": "756169620",
    "title": "Who Can Ascend: The Deliverer - Micah 5:2-5a (10-2-2022)",
    "url": "https://vimeo.com/756169620",
    "date": "2022-10-02T18:00:23+00:00",
    "duration": 2458,
    "description": "Presented by John Wohlgemuth on October 2nd, 2022 at Henderson Hills Baptist Church in Edmond, Oklahoma. hhbc.com",
    "privacy": "anybody"
  },
  {
    "id": "756120080",
    "title": "6. Disciple Making 101: Make Disciples Like Jesus (9-28-2022)",
    "url": "https://vimeo.com/756120080",
    "date": "2022-10-02T13:43:11+00:00",
    "duration": 1382,
    "description": "Presented by Phil Sallee on September 28th, 2022 at Henderson Hills Baptist Church in Edmond, Oklahoma. hhbc.com",
    "privacy": "anybody"
  },
  {
    "id": "753648170",
    "title": "Transformation Marriage Weekend: Session 3 - How Do We Reconnect? (9-24-2022)",
    "url": "https://vimeo.com/753648170",
    "date": "2022-09-25T23:15:05+00:00",
    "duration": 4252,
    "description": null,
    "privacy": "anybody"
  },
  {
    "id": "753640575",
    "title": "Transformation Marriage Weekend: Session 2 - What Happened to Us? With Q&A (9-23-2022)",
    "url": "https://vimeo.com/753640575",
    "date": "2022-09-25T22:29:46+00:00",
    "duration": 4612,
    "description": null,
    "privacy": "anybody"
  },
  {
    "id": "753637696",
    "title": "Transformation Marriage Weekend: Session 1 - Why Do We Get Married? (9-23-2022)",
    "url": "https://vimeo.com/753637696",
    "date": "2022-09-25T22:11:49+00:00",
    "duration": 3043,
    "description": null,
    "privacy": "anybody"
  },
  {
    "id": "753635620",
    "title": "5. Disciple Making 101: How to Identify Disciples - Are They Deployed into the World (9-21-2022)",
    "url": "https://vimeo.com/753635620",
    "date": "2022-09-25T21:59:19+00:00",
    "duration": 1561,
    "description": "Presented by Phil Sallee on September 21st, 2022 at Henderson Hills Baptist Church in Edmond, Oklahoma. hhbc.com",
    "privacy": "anybody"
  },
  {
    "id": "753586630",
    "title": "Who Can Ascend: A Delivered Nation - Micah 4:6-5:1 (9-25-2022)",
    "url": "https://vimeo.com/753586630",
    "date": "2022-09-25T17:35:43+00:00",
    "duration": 2386,
    "description": "Presented by John Wohlgemuth on September 25th, 2022 at Henderson Hills Baptist Church in Edmond, Oklahoma. hhbc.com",
    "privacy": "anybody"
  },
  {
    "id": "750977449",
    "title": "Christian Parenting (9-14-2022)",
    "url": "https://vimeo.com/750977449",
    "date": "2022-09-18T18:56:09+00:00",
    "duration": 4371,
    "description": "Presented by John Wohlgemuth on September 14th, 2022 at Henderson Hills Baptist Church in Edmond, Oklahoma. hhbc.com",
    "privacy": "anybody"
  },
  {
    "id": "750972108",
    "title": "Who Can Ascend: A Delivered City - Micah 4:1-5 (9-18-2022)",
    "url": "https://vimeo.com/750972108",
    "date": "2022-09-18T18:31:09+00:00",
    "duration": 2637,
    "description": "Presented by John Wohlgemuth on September 18th, 2022 at Henderson Hills Baptist Church in Edmond, Oklahoma. hhbc.com",
    "privacy": "anybody"
  },
  {
    "id": "748555464",
    "title": "4. Disciple Making 101: How to Identify Disciples - Are they Developing in Character (9-7-2022)",
    "url": "https://vimeo.com/748555464",
    "date": "2022-09-11T19:26:15+00:00",
    "duration": 1588,
    "description": "Presented by Phil Sallee on September 7th, 2022 at Henderson Hills Baptist Church in Edmond, Oklahoma. hhbc.com",
    "privacy": "anybody"
  },
  {
    "id": "748538850",
    "title": "Who Can Ascend: Judgment on Leaders - Micah 3:1-12 (9-11-2022)",
    "url": "https://vimeo.com/748538850",
    "date": "2022-09-11T17:54:39+00:00",
    "duration": 2868,
    "description": "Presented by John Wohlgemuth on September 11th, 2022 at Henderson Hills Baptist Church in Edmond, Oklahoma. hhbc.com",
    "privacy": "anybody"
  },
  {
    "id": "747680367",
    "title": "MOJ Intake Video",
    "url": "https://vimeo.com/747680367",
    "date": "2022-09-08T14:29:28+00:00",
    "duration": 854,
    "description": null,
    "privacy": "anybody"
  },
  {
    "id": "746338472",
    "title": "3. Disciple Making 101: How to Identify Disciples - Are they Devoted to Christ (8-31-2022)",
    "url": "https://vimeo.com/746338472",
    "date": "2022-09-04T18:40:24+00:00",
    "duration": 1408,
    "description": "Presented by Phil Sallee on August 31st, 2022 at Henderson Hills Baptist Church in Edmond, Oklahoma. hhbc.com",
    "privacy": "anybody"
  },
  {
    "id": "746334774",
    "title": "The Psalms: Worship from the Heart - Psalm 50 (9-4-2022)",
    "url": "https://vimeo.com/746334774",
    "date": "2022-09-04T18:16:37+00:00",
    "duration": 2377,
    "description": "Presented by John Wohlgemuth on September 4th, 2022 at Henderson Hills Baptist Church in Edmond, Oklahoma. hhbc.com",
    "privacy": "anybody"
  },
  {
    "id": "743963617",
    "title": "2. Disciple Making 101: The End Product (8-24-22)",
    "url": "https://vimeo.com/743963617",
    "date": "2022-08-28T18:25:34+00:00",
    "duration": 1217,
    "description": "Presented by Phil Sallee on August 24th, 2022 at Henderson Hills Baptist Church in Edmond, Oklahoma. hhbc.com",
    "privacy": "anybody"
  },
  {
    "id": "743960347",
    "title": "Who Can Ascend: Judgement on Oppressors - Micah 2:1-13 (8-28-2022)",
    "url": "https://vimeo.com/743960347",
    "date": "2022-08-28T18:07:17+00:00",
    "duration": 2632,
    "description": "Presented by John Wohlgemuth on August 28th, 2022 at Henderson Hills Baptist Church in Edmond, Oklahoma. hhbc.com",
    "privacy": "anybody"
  },
  {
    "id": "741653670",
    "title": "1. Disciple Making 101: The Goal (8-17-22)",
    "url": "https://vimeo.com/741653670",
    "date": "2022-08-21T18:55:51+00:00",
    "duration": 1929,
    "description": "Presented by Phil Sallee on August 17th, 2022 at Henderson Hills Baptist Church in Edmond, Oklahoma. hhbc.com",
    "privacy": "anybody"
  },
  {
    "id": "741641400",
    "title": "Who Can Ascend: Judgement on Sin - Micah 1:2-16 (8-21-2022)",
    "url": "https://vimeo.com/741641400",
    "date": "2022-08-21T17:46:28+00:00",
    "duration": 2184,
    "description": "Presented by John Wohlgemuth on August 21st, 2022 at Henderson Hills Baptist Church in Edmond, Oklahoma. hhbc.com",
    "privacy": "anybody"
  },
  {
    "id": "739436040",
    "title": "Who Can Ascend: Context & Overview - Micah 1:1 (8-14-2022)",
    "url": "https://vimeo.com/739436040",
    "date": "2022-08-14T17:47:27+00:00",
    "duration": 2645,
    "description": "Presented by John Wohlgemuth on August 14th, 2022 at Henderson Hills Baptist Church in Edmond, Oklahoma. hhbc.com",
    "privacy": "anybody"
  },
  {
    "id": "737333270",
    "title": "Parables: The Talents - Luke 19:11-27 (8-7-2022)",
    "url": "https://vimeo.com/737333270",
    "date": "2022-08-07T17:37:25+00:00",
    "duration": 2404,
    "description": "Presented by John Wohlgemuth on August 7th, 2022 at Henderson Hills Baptist Church in Edmond, Oklahoma. hhbc.com",
    "privacy": "anybody"
  },
  {
    "id": "735214540",
    "title": "Parables: The Pharisee & The Tax Collector - Luke 18:9-14 (7-31-2022)",
    "url": "https://vimeo.com/735214540",
    "date": "2022-07-31T17:42:37+00:00",
    "duration": 2194,
    "description": "Presented by Dr. T.R. Lewis on July 31st, 2022 at Henderson Hills Baptist Church in Edmond, Oklahoma. hhbc.com",
    "privacy": "anybody"
  },
  {
    "id": "733003403",
    "title": "Parables: The Lost Sheep, Coin, and Sons - Luke 15:1-32 (7-24-2022)",
    "url": "https://vimeo.com/733003403",
    "date": "2022-07-24T18:05:59+00:00",
    "duration": 2352,
    "description": "Presented by John Wohlgemuth on July 24th, 2022 at Henderson Hills Baptist Church in Edmond, Oklahoma. hhbc.com",
    "privacy": "anybody"
  },
  {
    "id": "730789118",
    "title": "Parables: The Two Builders - Luke 6:46-49 (7-17-2022)",
    "url": "https://vimeo.com/730789118",
    "date": "2022-07-17T18:21:39+00:00",
    "duration": 2548,
    "description": "Presented by Allen Rice on July 17th, 2022 at Henderson Hills Baptist Church in Edmond, Oklahoma. hhbc.com",
    "privacy": "anybody"
  },
  {
    "id": "728607010",
    "title": "Parables: The Samaritan - Luke 10:25-37 (7-10-2022)",
    "url": "https://vimeo.com/728607010",
    "date": "2022-07-10T17:47:06+00:00",
    "duration": 2134,
    "description": "Presented by Phil Sallee on July 10th, 2022 at Henderson Hills Baptist Church in Edmond, Oklahoma. hhbc.com",
    "privacy": "anybody"
  },
  {
    "id": "726510578",
    "title": "Parables: The Tower Builder & The Warring King - Luke 14:25-33 (7-3-2022)",
    "url": "https://vimeo.com/726510578",
    "date": "2022-07-03T17:52:32+00:00",
    "duration": 2563,
    "description": "Presented by John Wohlgemuth on July 3rd, 2022 at Henderson Hills Baptist Church in Edmond, Oklahoma. hhbc.com",
    "privacy": "anybody"
  },
  {
    "id": "724235990",
    "title": "Parables: The Wedding Feast - Luke 14:16-24 (6-26-2022)",
    "url": "https://vimeo.com/724235990",
    "date": "2022-06-26T17:50:00+00:00",
    "duration": 2552,
    "description": "Presented by John Wohlgemuth on June 26th, 2022 at Henderson Hills Baptist Church in Edmond, Oklahoma. hhbc.com",
    "privacy": "anybody"
  },
  {
    "id": "721996378",
    "title": "Parables: The Rich Fool - Luke 12:13-21 (6-19-2022)",
    "url": "https://vimeo.com/721996378",
    "date": "2022-06-19T21:42:03+00:00",
    "duration": 2289,
    "description": "Presented by John Wohlgemuth on June 19th, 2022 at Henderson Hills Baptist Church in Edmond, Oklahoma. hhbc.com",
    "privacy": "anybody"
  },
  {
    "id": "719619215",
    "title": "Parables: The Two Debtors - Luke 7:36-50 (6-12-2022)",
    "url": "https://vimeo.com/719619215",
    "date": "2022-06-12T18:24:24+00:00",
    "duration": 2429,
    "description": "Presented by John Wohlgemuth on June 12th, 2022 at Henderson Hills Baptist Church in Edmond, Oklahoma. hhbc.com",
    "privacy": "anybody"
  },
  {
    "id": "717305947",
    "title": "Parables: The Sower - Luke 8:4-15 (6-5-2022)",
    "url": "https://vimeo.com/717305947",
    "date": "2022-06-05T18:59:18+00:00",
    "duration": 2383,
    "description": "Presented by John Wohlgemuth on June 6th, 2022 at Henderson Hills Baptist Church in Edmond, Oklahoma. hhbc.com",
    "privacy": "anybody"
  },
  {
    "id": "714981056",
    "title": "The Psalms: Wealth vs. Death - Psalm 49 (5-29-2022)",
    "url": "https://vimeo.com/714981056",
    "date": "2022-05-29T17:31:55+00:00",
    "duration": 2389,
    "description": "Presented by John Wohlgemuth on May 29th, 2022 at Henderson Hills Baptist Church in Edmond, Oklahoma. hhbc.com",
    "privacy": "anybody"
  },
  {
    "id": "712683122",
    "title": "Jesus: To Love Him is to...Give - 2 Corinthians 8:1-9:15 (5-22-2022)",
    "url": "https://vimeo.com/712683122",
    "date": "2022-05-23T01:05:27+00:00",
    "duration": 2567,
    "description": "Presented by John Wohlgemuth on May 22nd, 2022 at Henderson Hills Baptist Church in Edmond, Oklahoma. hhbc.com",
    "privacy": "anybody"
  },
  {
    "id": "711706455",
    "title": "How We Got the Bible: Equipping Night 7 - Dan Leiphart (5-18-2022)",
    "url": "https://vimeo.com/711706455",
    "date": "2022-05-19T15:36:53+00:00",
    "duration": 4526,
    "description": null,
    "privacy": "anybody"
  },
  {
    "id": "710099473",
    "title": "Jesus: To Love Him is to...Serve - 1 Corinthians 12:12-27 (5-15-2022)",
    "url": "https://vimeo.com/710099473",
    "date": "2022-05-15T17:46:18+00:00",
    "duration": 2296,
    "description": "Presented by Ryan Whitaker on May 15th, 2022 at Henderson Hills Baptist Church in Edmond, Oklahoma. hhbc.com",
    "privacy": "anybody"
  },
  {
    "id": "709224022",
    "title": "How We Got the Bible: Equipping Night 6 - Dan Leiphart (5-11-2022)",
    "url": "https://vimeo.com/709224022",
    "date": "2022-05-12T19:15:19+00:00",
    "duration": 4393,
    "description": null,
    "privacy": "anybody"
  },
  {
    "id": "707545702",
    "title": "Jesus: To Love Him is to...Fast - Matthew 6:16-18 (5-8-2022)",
    "url": "https://vimeo.com/707545702",
    "date": "2022-05-08T17:38:26+00:00",
    "duration": 1966,
    "description": "Presented by John Wohlgemuth on May 8th, 2022 at Henderson Hills Baptist Church in Edmond, Oklahoma. hhbc.com",
    "privacy": "anybody"
  },
  {
    "id": "705485351",
    "title": "Joyful Sound Choir Concert (4-28-2022)",
    "url": "https://vimeo.com/705485351",
    "date": "2022-05-02T19:10:49+00:00",
    "duration": 4433,
    "description": null,
    "privacy": "anybody"
  },
  {
    "id": "705151037",
    "title": "Jesus: To Love Him is to...Pray - Matthew 6:5-15 (5-1-2022)",
    "url": "https://vimeo.com/705151037",
    "date": "2022-05-01T18:50:53+00:00",
    "duration": 2617,
    "description": "Presented by John Wohlgemuth on May 1st, 2022 at Henderson Hills Baptist Church in Edmond, Oklahoma. hhbc.com",
    "privacy": "anybody"
  },
  {
    "id": "704243976",
    "title": "How We Got the Bible: Equipping Night 5 - Dan Leiphart (4-27-2022)",
    "url": "https://vimeo.com/704243976",
    "date": "2022-04-28T17:44:51+00:00",
    "duration": 4285,
    "description": null,
    "privacy": "anybody"
  },
  {
    "id": "702594805",
    "title": "Jesus: To Love Him is to...Study - 2 Timothy 3:16-17 (4-24-2022)",
    "url": "https://vimeo.com/702594805",
    "date": "2022-04-24T17:34:43+00:00",
    "duration": 2530,
    "description": "Presented by John Wohlgemuth on April 24th, 2022 at Henderson Hills Baptist Church in Edmond, Oklahoma. hhbc.com",
    "privacy": "anybody"
  },
  {
    "id": "701781932",
    "title": "How We Got the Bible: Equipping Night 4 - Dan Leiphart (4-20-2022)",
    "url": "https://vimeo.com/701781932",
    "date": "2022-04-21T19:02:41+00:00",
    "duration": 4034,
    "description": null,
    "privacy": "anybody"
  },
  {
    "id": "700228022",
    "title": "Behold the Passion of Jesus: Sunday - Luke 24:1-49 (4-17-2022)",
    "url": "https://vimeo.com/700228022",
    "date": "2022-04-17T16:25:06+00:00",
    "duration": 2293,
    "description": "Presented by John Wohlgemuth on April 17th, 2022 at Henderson Hills Baptist Church in Edmond, Oklahoma. hhbc.com",
    "privacy": "anybody"
  },
  {
    "id": "699527210",
    "title": "How We Got the Bible: Equipping Night 3 - Dan Leiphart (4-13-2022)",
    "url": "https://vimeo.com/699527210",
    "date": "2022-04-14T17:31:56+00:00",
    "duration": 4495,
    "description": null,
    "privacy": "anybody"
  },
  {
    "id": "697937379",
    "title": "Behold the Passion of Jesus: Friday - Luke 23:26-56 (4-10-2022)",
    "url": "https://vimeo.com/697937379",
    "date": "2022-04-10T18:02:29+00:00",
    "duration": 2679,
    "description": "Presented by John Wohlgemuth on April 10th, 2022 at Henderson Hills Baptist Church in Edmond, Oklahoma. hhbc.com",
    "privacy": "anybody"
  },
  {
    "id": "697093582",
    "title": "How We Got the Bible: Equipping Night 2 - Dan Leiphart (4-6-2022)",
    "url": "https://vimeo.com/697093582",
    "date": "2022-04-07T18:26:00+00:00",
    "duration": 4186,
    "description": null,
    "privacy": "anybody"
  },
  {
    "id": "695456468",
    "title": "Behold the Passion of Jesus: Thursday Night - Luke 22:63-23:25 (4-3-2022)",
    "url": "https://vimeo.com/695456468",
    "date": "2022-04-03T18:12:22+00:00",
    "duration": 2474,
    "description": "Presented by John Wohlgemuth on April 3rd, 2022 at Henderson Hills Baptist Church in Edmond, Oklahoma. hhbc.com",
    "privacy": "anybody"
  },
  {
    "id": "694556238",
    "title": "How We Got the Bible: Equipping Night 1 - Dan Leiphart (3-30-2022)",
    "url": "https://vimeo.com/694556238",
    "date": "2022-03-31T18:33:39+00:00",
    "duration": 4383,
    "description": null,
    "privacy": "anybody"
  },
  {
    "id": "692830854",
    "title": "Behold the Passion of Jesus: Thursday Evening - Luke 22:1-62 (3-27-2022)",
    "url": "https://vimeo.com/692830854",
    "date": "2022-03-27T17:43:05+00:00",
    "duration": 2380,
    "description": "Presented by John Wohlgemuth on March 27th, 2022 at Henderson Hills Baptist Church in Edmond, Oklahoma. hhbc.com",
    "privacy": "anybody"
  },
  {
    "id": "691946126",
    "title": "Worldview Matters: Equipping Night 7 - Aaron Ferguson (3-23-2022)",
    "url": "https://vimeo.com/691946126",
    "date": "2022-03-24T18:03:34+00:00",
    "duration": 4612,
    "description": null,
    "privacy": "anybody"
  },
  {
    "id": "690248642",
    "title": "The Psalms: Safety & Security - Psalm 48 (3-20-2022)",
    "url": "https://vimeo.com/690248642",
    "date": "2022-03-20T17:16:18+00:00",
    "duration": 2071,
    "description": "Presented by Jimmy Quinn on March 20th, 2022 at Henderson Hills Baptist Church in Edmond, Oklahoma. hhbc.com",
    "privacy": "anybody"
  },
  {
    "id": "687681430",
    "title": "The Psalms: Praise the King over all Nations - Psalm 47 (3-13-2022)",
    "url": "https://vimeo.com/687681430",
    "date": "2022-03-13T17:20:32+00:00",
    "duration": 1999,
    "description": "Presented by Brett Middleton on March 13th, 2022 at Henderson Hills Baptist Church in Edmond, Oklahoma. hhbc.com",
    "privacy": "anybody"
  },
  {
    "id": "686822656",
    "title": "Worldview Matters: Equipping Night 6 - Aaron Ferguson (3-9-2022)",
    "url": "https://vimeo.com/686822656",
    "date": "2022-03-10T18:46:58+00:00",
    "duration": 4254,
    "description": null,
    "privacy": "anybody"
  },
  {
    "id": "685288429",
    "title": "Behold: The Self-Control of Jesus - Luke 4:1-13 (3-6-2022)",
    "url": "https://vimeo.com/685288429",
    "date": "2022-03-07T01:27:11+00:00",
    "duration": 2616,
    "description": "Presented by John Wohlgemuth on March 6th, 2022 at Henderson Hills Baptist Church in Edmond, Oklahoma. hhbc.com",
    "privacy": "anybody"
  },
  {
    "id": "684371931",
    "title": "Worldview Matters: Equipping Night 5 - Aaron Ferguson (3-2-2022)",
    "url": "https://vimeo.com/684371931",
    "date": "2022-03-03T19:35:39+00:00",
    "duration": 4685,
    "description": null,
    "privacy": "anybody"
  },
  {
    "id": "683844882",
    "title": "Child Abuse Prevention",
    "url": "https://vimeo.com/683844882",
    "date": "2022-03-02T15:33:40+00:00",
    "duration": 3629,
    "description": null,
    "privacy": "anybody"
  },
  {
    "id": "682558291",
    "title": "Behold: The Kingship of Jesus - Luke 19:28-40 (2-27-2022)",
    "url": "https://vimeo.com/682558291",
    "date": "2022-02-27T18:45:32+00:00",
    "duration": 2393,
    "description": "Presented by John Wohlgemuth on February 27th, 2022 at Henderson Hills Baptist Church in Edmond, Oklahoma. hhbc.com",
    "privacy": "anybody"
  },
  {
    "id": "679752846",
    "title": "Behold: The Faithfulness of Jesus - Luke 2:39-52 (2-20-2022)",
    "url": "https://vimeo.com/679752846",
    "date": "2022-02-20T18:34:37+00:00",
    "duration": 2353,
    "description": "Presented by John Wohlgemuth on February 20th, 2022 at Henderson Hills Baptist Church in Edmond, Oklahoma. hhbc.com",
    "privacy": "anybody"
  },
  {
    "id": "678838304",
    "title": "Worldview Matters: Equipping Night 4 - Aaron Ferguson (2-16-2022)",
    "url": "https://vimeo.com/678838304",
    "date": "2022-02-17T18:50:26+00:00",
    "duration": 4606,
    "description": null,
    "privacy": "anybody"
  },
  {
    "id": "676875121",
    "title": "Behold: The Goodness of Jesus - Luke 5:12-26 (2-13-2022)",
    "url": "https://vimeo.com/676875121",
    "date": "2022-02-13T19:34:59+00:00",
    "duration": 2315,
    "description": "Presented by John Wohlgemuth on February 13th, 2022 at Henderson Hills Baptist Church in Edmond, Oklahoma. hhbc.com",
    "privacy": "anybody"
  },
  {
    "id": "676028146",
    "title": "Worldview Matters: Equipping Night 3 - Aaron Ferguson (2-9-2022)",
    "url": "https://vimeo.com/676028146",
    "date": "2022-02-10T19:51:21+00:00",
    "duration": 4557,
    "description": null,
    "privacy": "anybody"
  },
  {
    "id": "676020663",
    "title": "Worldview Matters: Equipping Night 2 - Aaron Ferguson (1-26-2022)",
    "url": "https://vimeo.com/676020663",
    "date": "2022-02-10T19:29:20+00:00",
    "duration": 4512,
    "description": null,
    "privacy": "anybody"
  },
  {
    "id": "676007405",
    "title": "Worldview Matters: Equipping Night 1 - Aaron Ferguson (1-19-2022)",
    "url": "https://vimeo.com/676007405",
    "date": "2022-02-10T18:52:39+00:00",
    "duration": 4195,
    "description": null,
    "privacy": "anybody"
  },
  {
    "id": "674184823",
    "title": "Behold: The Kindness of Jesus - Luke 6:27-36 (2-6-2022)",
    "url": "https://vimeo.com/674184823",
    "date": "2022-02-06T18:52:16+00:00",
    "duration": 2345,
    "description": "Presented by John Wohlgemuth on February 6th, 2022 at Henderson Hills Baptist Church in Edmond, Oklahoma. hhbc.com",
    "privacy": "anybody"
  },
  {
    "id": "671713988",
    "title": "Behold: The Patience of Jesus - Luke 13:1-9 (1-30-2022)",
    "url": "https://vimeo.com/671713988",
    "date": "2022-01-30T18:56:59+00:00",
    "duration": 2156,
    "description": "Presented by John Wohlgemuth on January 30th, 2022 at Henderson Hills Baptist Church in Edmond, Oklahoma. hhbc.com",
    "privacy": "anybody"
  },
  {
    "id": "669197524",
    "title": "Behold: The Peace of Jesus - Luke 9:51-62 (1-23-2022)",
    "url": "https://vimeo.com/669197524",
    "date": "2022-01-23T20:39:01+00:00",
    "duration": 2494,
    "description": "Presented by John Wohlgemuth on January 23rd, 2022 at Henderson Hills Baptist Church in Edmond, Oklahoma. hhbc.com",
    "privacy": "anybody"
  },
  {
    "id": "666525974",
    "title": "Guest Speaker - Bill Liggett (1-16-2022)",
    "url": "https://vimeo.com/666525974",
    "date": "2022-01-16T18:35:49+00:00",
    "duration": 1942,
    "description": "Presented by Bill Liggett on January 16th, 2022 at Henderson Hills Baptist Church in Edmond, Oklahoma. hhbc.com",
    "privacy": "anybody"
  },
  {
    "id": "665772145",
    "title": "Beyond the Talk: Protecting Your Children Online - Jason Kushmaul (1-12-2022)",
    "url": "https://vimeo.com/665772145",
    "date": "2022-01-13T20:16:54+00:00",
    "duration": 4386,
    "description": null,
    "privacy": "anybody"
  },
  {
    "id": "665768221",
    "title": "Beyond the Talk: God's Design for Gender - Blair Holland (1-12-2022)",
    "url": "https://vimeo.com/665768221",
    "date": "2022-01-13T20:04:24+00:00",
    "duration": 1393,
    "description": null,
    "privacy": "anybody"
  },
  {
    "id": "665762684",
    "title": "Beyond the Talk: As the World Turns - John Wohlgemuth (1-12-2022)",
    "url": "https://vimeo.com/665762684",
    "date": "2022-01-13T19:47:35+00:00",
    "duration": 4278,
    "description": null,
    "privacy": "anybody"
  },
  {
    "id": "663988172",
    "title": "Behold: The Love of Jesus - Luke 19:1-10 (1-9-2022)",
    "url": "https://vimeo.com/663988172",
    "date": "2022-01-09T18:31:20+00:00",
    "duration": 2514,
    "description": "Presented by John Wohlgemuth on January 9th, 2022 at Henderson Hills Baptist Church in Edmond, Oklahoma. hhbc.com",
    "privacy": "anybody"
  },
  {
    "id": "662020733",
    "title": "The Psalms: God Is Our Fortress - Psalm 46 (1-2-2022)",
